Time,User_ID,Tweet,like_count,reply_count,retweet_count,language
2022-02-24 00:23:57+00:00,86141342,ONE-ON-ONE WITH SECY. BLINKEN: @DavidMuir goes one-on-one with U.S. Secretary of State Antony Blinken who said there will be “massive consequences” if Putin escalates a Russian invasion of Ukraine. https://t.co/N6PX4MAjBa https://t.co/lNompKyw9D,223,61,82,en
2022-02-24 00:27:02+00:00,86141342,"After more than 30 months in detention centers, Kelvin Silva was deported last week by U.S. Immigration and Customs Enforcement to the Dominican Republic. His mother, children and siblings continue to live in the U.S. https://t.co/9xwVzeHAVj",13,9,10,en
2022-02-24 01:05:13+00:00,86141342,A woman who survived three heart attacks in three days at age 40 is now leading an effort to make Black women aware of the risks of heart disease. https://t.co/ksCjmbLRhN,32,4,13,en
2022-02-24 01:22:49+00:00,86141342,Secretary of State Antony Blinken to @DavidMuir: “Everything we’ve seen over the last 24 to 48 hours has Russia putting the final touches...to be ready for a full-on invasion.” https://t.co/N6PX4MAjBa https://t.co/gKSB0Bft3Z,145,35,76,en
2022-02-24 01:45:50+00:00,86141342,PRESSURING PUTIN: @CeciliaVega reports as the Biden administration still vows to pursue diplomacy despite the dire outlook and the White House doubles down on its pledge that we won’t see American troops in Ukraine. https://t.co/N6PX4MAjBa https://t.co/IxGSFLTiDC,20,8,16,en
2022-02-24 02:00:00+00:00,86141342,POISED TO STRIKE? @MarthaRaddatz has more from Ukraine as the Pentagon says of Russian troops “they are ready” amid signs that a full-scale invasion of Ukraine is imminent. https://t.co/N6PX4MRUsI https://t.co/dZ1F3mUmYD,26,3,21,en
2022-02-24 03:00:02+00:00,86141342,"SPREADING OUT VACCINATIONS: The CDC is now recommending that many Americans wait up to eight weeks between their first and second shots of Pfizer, Moderna vaccines instead of three to four. @sramosABC has details. https://t.co/bipZha1QaO https://t.co/8KUblv34Rr",31,4,15,en
2022-02-24 12:34:01+00:00,86141342,"BREAKING: At least 40 people have been killed Thursday in Russia's attack on Ukraine, according to Oleksiy Arestovich, an adviser to Ukrainian Pres. Volodymyr Zelenskyy. https://t.co/AXhNI0QGqT https://t.co/tCswiQjzp0",55,4,39,en
2022-02-24 12:36:02+00:00,86141342,NATO envoys met in emergency session after Russian Pres. Vladimir Putin ordered a large-scale attack on Ukraine as the 30-nation military organization prepares to bolster its defenses in allies neighboring both countries. https://t.co/Vf1MIKYjSt,33,6,13,en
2022-02-24 12:38:28+00:00,86141342,"Video published by the Ukraine border guard service claims to show Russian military vehicles moving across checkpoint where the borders of Ukraine, Russia and Belarus meet. https://t.co/HHaMeee9Ka https://t.co/FeLvV8xo0X",59,6,40,en
2022-02-24 12:40:34+00:00,86141342,Russia appears to be establishing military censorship of media coverage of its invasion of neighboring Ukraine. https://t.co/bHpWAmX7v0,25,3,10,en
2022-02-24 13:00:11+00:00,86141342,"LATEST: Ukraine's energy system has temporarily cut itself off from the power grids of neighboring Russia and Belarus, according to Ukrainian transmission system operator Ukrenergo. https://t.co/pUySjcwf1x",18,3,14,en
2022-02-24 13:10:05+00:00,86141342,"Russia's parliament speaker claims that the ""sole purpose"" of the country's invasion of Ukraine ""is to secure peace,"" saying ""Russia has never been an enemy."" https://t.co/qobAroK7h5 https://t.co/ws1pLbmQ1b",26,25,14,en
2022-02-24 13:46:17+00:00,86141342,"A Ukrainian military aircraft carrying 14 people crashed in the Kyiv region, killing at least five of them, according to Ukraine's Ministry of Internal Affairs. https://t.co/AX3gloqZSp",19,4,14,en
2022-02-24 13:55:06+00:00,86141342,"Russian Federal Service for Supervision of Communications, Information Technology and Mass Media warns that all Russian media outlets are required to use information exclusively from official Russian sources while covering military operations in Ukraine. https://t.co/a5gPW4PRSI https://t.co/bxzGNZJmvQ",28,3,21,en
2022-02-24 14:05:08+00:00,86141342,"NEW: Former Pres. George W. Bush condemns Russia’s attack on Ukraine, calling it the “gravest security crisis on the European continent since World War II.”

“We cannot tolerate the authoritarian bullying and danger that Putin poses.” https://t.co/T4EM2aL8Qa https://t.co/6jLc2Rnz0G",338,30,79,en
2022-02-24 14:37:04+00:00,86141342,"Russia's military launched a long-feared invasion of Ukraine early Thursday, attacking its ex-Soviet neighbor from multiple directions despite warnings of dire consequences from the U.S. and the international community.

LIVE UPDATES: https://t.co/nLsYslbr14 https://t.co/eQUc67MXeV",37,5,20,en
2022-02-24 15:11:44+00:00,86141342,"BREAKING: Pres. Biden to deliver remarks ""on Russia’s unprovoked and unjustified attack on Ukraine"" at 12:30 p.m. ET, White House says. https://t.co/TEhj7lXMNv https://t.co/8fefXcP6SM",39,9,22,en
2022-02-24 15:45:36+00:00,86141342,"Photo shows people boarding a bus to evacuate Kyiv amid Russia's long-feared invasion of Ukraine.

LIVE UPDATES: https://t.co/ywqqrpdaFV https://t.co/aizlq7BJqG",40,5,17,en
2022-02-24 16:07:49+00:00,86141342,"U.K. Prime Minister Boris Johnson: ""We must ... collectively cease the dependence on Russian oil and gas that for too long has given Putin his grip on Western politics."" https://t.co/6igv1pRwRh https://t.co/zGgj3T3KPn",111,9,28,en
2022-02-24 16:30:59+00:00,86141342,📸 Pres. Biden meets with the National Security Council this morning in the White House Situation Room to discuss the latest developments in Ukraine. https://t.co/N8aBQTfTqN https://t.co/djzhlwmuI7,71,14,22,en
2022-02-24 17:18:01+00:00,86141342,"The White House has begun a sweeping overhaul of its COVID strategy that will signal the nation is moving past crisis mode and into a more manageable phase in the pandemic, @ABC News has learned. https://t.co/593vEeekUa",24,1,9,en
2022-02-24 17:19:01+00:00,86141342,"There are concerns that artillery could hit the reactor amid fighting.

LIVE UPDATES: https://t.co/9jRENmxMjE https://t.co/Lc6Kde9scQ",35,10,21,en
2022-02-24 17:43:50+00:00,86141342,"LATEST: The leaders of the G-7 countries condemn Russia's attack in a joint statement and vow to bring ""severe and coordinated economic and financial sanctions."" https://t.co/Dh6Wq5hPD1",45,4,14,en
2022-02-24 18:01:57+00:00,86141342,"Pres. Biden says G7 leaders “agreed to move forward on devastating packages of sanctions and other economic measures to hold Russia to account.” 

“We stand with the brave people of Ukraine.” https://t.co/635ipbP62e https://t.co/UpBo9oaQIj",102,6,35,en
2022-02-24 18:18:10+00:00,86141342,"LATEST: Boris Johnson announces new package of sanctions targeting over 100 Russian entities and individuals.

Johnson says this would totally exclude Russian banks from the U.K. financial system, adding, ""oligarchs in London will have nowhere to hide."" https://t.co/HI7zksJwY0",67,7,24,en
2022-02-24 18:19:08+00:00,86141342,"BREAKING: Ukraine has lost control of a key military airport located less than 20 miles from the center of Kyiv, according to Ukraine’s deputy interior minister. https://t.co/HnGqk6ADtG",23,2,22,en
2022-02-24 18:21:11+00:00,86141342,"Protesters arrested in Moscow and St. Petersburg at demonstrations against Russia's invasion of Ukraine.

LIVE UPDATES: https://t.co/LdXXSlbhjT https://t.co/9reKBuUziR",162,15,84,en
2022-02-24 18:52:58+00:00,86141342,"BREAKING: Pres. Biden: ""Putin is the aggressor. Putin chose this war. And now he and his country will bear the consequences."" https://t.co/qHac9iJhYv https://t.co/7NHKe0ok5p",91,11,37,en
2022-02-24 18:53:11+00:00,86141342,"BREAKING: Pres. Biden authorizes ""additional strong sanctions"" against Russia.

""We have purposefully designed these sanctions to maximize the long-term impact on Russia and to minimize the impact on the United States and our allies."" https://t.co/CZD2inXTzi https://t.co/fGXB9txDm4",50,8,25,en
2022-02-24 19:01:37+00:00,86141342,"Pres. Biden says countries representing “well more than half the global economy” are implementing economy sanctions against Russia. 

“We will limit Russia’s ability to do business in dollars, euros, pounds and yen.” https://t.co/CZD2inXTzi https://t.co/3t4lOPR9eM",5532,531,911,en
2022-02-24 19:38:33+00:00,86141342,".@IanPannell to @DavidMuir on Russian invasion of Ukraine: ""The situation on the ground is serious, and it's growing more serious really by the hour."" https://t.co/Y0PhsCbYly https://t.co/1XPE2L6XzJ",85,7,28,en
2022-02-24 19:46:04+00:00,86141342,"LATEST:

- Biden authorizes 'additional strong sanctions' against Russia

- Chernobyl taken by Russian forces, Ukraine says

- US official: this is 'initial phases of a large-scale invasion'

- G-7 leaders bringing 'severe' coordinated sanctions

MORE: https://t.co/xaPKhuatnv",23,6,14,en
2022-02-24 20:00:22+00:00,86141342,"People attend an anti-war protest in Saint Petersburg, Russia, amid Vladimir Putin's invasion of Ukraine. 

LIVE UPDATES: https://t.co/ggEzsE9N1e https://t.co/QwSDErQMWU",7662,101,1269,en
2022-02-24 20:04:55+00:00,86141342,"""Hundreds actually came out here in downtown Moscow to protest against the decision to invade Ukraine.""

@JamesAALongman told @DavidMuir as some Russians protesting the Russian invasion of Ukraine are being swiftly taken off the streets.   https://t.co/Y0PhsCbYly https://t.co/dBlMLitoL6",84,4,36,en
2022-02-24 20:15:06+00:00,86141342,"""Block Putin's wallet.""

Anti-war protesters gathered in London, calling for sanctions, amid Russia's military invasion of Ukraine. https://t.co/IuL8mNYkWo https://t.co/xzDSCVrT8u",118,5,36,en
2022-02-24 20:45:19+00:00,86141342,Ukrainians in the U.S. fear for loved ones back home amid Russian invasion. https://t.co/a5AhNnyWYy,51,5,24,en
2022-02-24 22:02:10+00:00,86141342,BREAKING: Jury reaches verdict in federal trial of former police officers involved in George Floyd's death. https://t.co/UBkwF0kCsM,40,2,13,en
2022-02-24 22:34:44+00:00,86141342,BREAKING: Three former Minneapolis police officers accused of violating George Floyd's civil rights have been found guilty on all counts. https://t.co/z9NeZhSoZy,46,1,15,en
2022-02-24 22:36:07+00:00,86141342,"NEW: Former Pres. Barack Obama: ""Michelle and I will be praying for the courageous people of Ukraine, for Russian citizens who have bravely declared their opposition to these attacks, and for all those who will bear the cost of a senseless war."" https://t.co/p4n8NEOBfu https://t.co/YwawJzoxdz",124,6,26,en
2022-02-24 22:56:02+00:00,86141342,"NEW: U.S. Secretary of State Antony Blinken to @DavidMuir: ""Is it a possibility that Putin goes beyond Ukraine? Sure, it's a possibility.""

More tonight on @ABCWorldNews. https://t.co/N6PX4MAjBa https://t.co/AD0zONIFlp",227,57,99,en
2022-02-24 23:00:26+00:00,86141342,"School counselor says Crumbley parents acted coldly toward son in meeting the morning of school shooting. 

The couple faces charges of involuntary manslaughter in the Nov. 30 massacre. https://t.co/R0y9bpTNqX",19,1,9,en
2022-02-24 23:07:26+00:00,86141342,".@DavidMuir to U.S. Secy. of State Antony Blinken: ""You're convinced Putin's going to overthrow [Ukraine's] government?""

Blinken: ""I'm convinced he's going to try to do that.""

More tonight on @ABCWorldNews. https://t.co/N6PX4MAjBa https://t.co/wwsMkDs7EN",509,41,191,en
2022-02-24 23:25:10+00:00,86141342,#WorldNewsTonight with @DavidMuir starts in FIVE minutes. RT if you're watching https://t.co/asCPyoVORP,70,18,36,en
2022-02-24 23:41:05+00:00,86141342,NEW: Ukrainian officials say they have reclaimed a key military airport on the edge of Kyiv that had been seized by Russian special forces. https://t.co/ogGlsYOrbf,86,6,27,en
2022-02-25 00:33:57+00:00,86141342,"ONE-ON-ONE WITH SECY. BLINKEN: @DavidMuir goes one-on-one with U.S. Secy. of State Antony Blinken who said “it’s a possibility” that Putin will go beyond Ukraine, adding that “everything is on the table” in regards to Putin being sanctioned. https://t.co/N6PX4MAjBa https://t.co/iNWusruaxy",81,28,40,en
2022-02-25 01:30:00+00:00,86141342,"Three former Minneapolis police officers Thomas Lane, J. Alexander Kueng and Tou Thao, have been found guilty on all counts by a federal jury for violating George Floyd's civil rights. @DavidMuir reports. https://t.co/BZOUlA9fcp https://t.co/w2IUiUXmhH",45,4,17,en
2022-02-25 02:40:00+00:00,86141342,RUSSIA INVADES UKRAINE: Russia has unleashed a brutal military assault on Ukraine as U.S. military sources say they believe the Russians are planning to surround Kyiv and “decapitate” the government. @IanPannell is there. https://t.co/N6PX4MRUsI https://t.co/3b70c68dpC,93,9,36,en
2022-02-25 03:00:02+00:00,86141342,PROTESTERS ARRESTED ACROSS RUSSIA: @JamesAALongman is in Moscow where demonstrators there and in other Russian cities and towns have been detained for protesting against the Russian invasion of Ukraine. https://t.co/N6PX4MRUsI https://t.co/3vtUBYyN0O,53,9,20,en
2022-02-25 03:30:00+00:00,86141342,PRESSURING PUTIN: @CeciliaVega is at the White House with more on the severe sanctions President Biden imposed on Russia after their invasion of Ukraine. https://t.co/N6PX4MAjBa https://t.co/2lqhtAfpZU,47,13,17,en
2022-02-25 04:00:00+00:00,86141342,"AMERICAN STRATEGY: @MarthaRaddatz reports from Lviv, Ukraine after a Russian invasion on the country with a show of force by the U.S. and NATO allies. https://t.co/N6PX4MAjBa https://t.co/35DzYVv4uP",60,16,24,en
2022-02-25 13:56:36+00:00,86141342,"BREAKING: Pres. Biden is expected to nominate Judge Ketanji Brown Jackson for the Supreme Court, elevating an African American woman for the first time to a seat on the high court bench, @ABC News has learned. https://t.co/Am5NDw0cHx",56,4,13,en
2022-02-25 14:10:07+00:00,86141342,"United Nations High Commissioner for Refugees estimates some 100,000 Ukrainians have already been forced from their homes due to the ongoing Russian invasion, spokesperson tells ABC News. https://t.co/OLRcYpusji https://t.co/6Fhx4ju2Dr",16,2,11,en
2022-02-25 14:45:14+00:00,86141342,The House Oversight and Reform Committee expands its investigation into former Pres. Trump’s handling of White House records. https://t.co/3bk9mulGok,68,10,17,en
2022-02-25 15:14:57+00:00,86141342,"In the port city of Mariupol, a young girl named Vlada was new to war and already wished for it to stop.

“I don’t want to die,” she said. “I want all of this to end as soon as possible.” https://t.co/q0aibRWLEp",40,3,14,en
2022-02-25 15:29:36+00:00,86141342,UKRAINE-RUSSIA LATEST: https://t.co/pziNwDfLL2 https://t.co/KBNoHdMocD,35,1,19,en
2022-02-25 15:58:40+00:00,86141342,"Sally Kellerman, Oscar and Emmy nominated actor whose career spanned more than 60 years, has died at 84. https://t.co/cNra25p32x",38,4,10,en
2022-02-25 16:27:12+00:00,86141342,Pope Francis has canceled a scheduled Sunday visit to Florence and will not preside over Ash Wednesday commemorations next week because of what the Vatican described as a flareup of “acute” knee pain. https://t.co/GviUI6Mas1,26,5,11,en
2022-02-25 16:32:41+00:00,86141342,NEW: Former Pres. Obama congratulates Judge Ketanji Brown Jackson as Pres. Biden is set to nominate her to the Supreme Court. https://t.co/snRFPumLfp https://t.co/Vao2Oz5Kg9,101,7,21,en
2022-02-25 17:05:29+00:00,86141342,"Some are real, horrifying images of this war. Others had been lurking on the internet for years before Russia launched the largest attack on a European country since World War II. https://t.co/MlpUoPbG1G",18,4,6,en
2022-02-25 17:32:30+00:00,86141342,"LATEST, per senior U.S. official:

- Officials are seeing more signs Russian Pres. Putin isn't interested in diplomatic solution.

- Russian troops are resupplied and planning multiple entrance points into Kyiv that will likely be carried out at once.

https://t.co/n9IqyN83RC",20,5,8,en
2022-02-25 17:49:22+00:00,86141342,"BREAKING: NATO has activated its NATO Response Force, marking the first time the alliance has activated the potentially 40,000-person force for “a deterrence and defence"" role, according to a NATO spokesperson. https://t.co/iRhwknjmaW",260,14,126,en
2022-02-25 17:59:06+00:00,86141342,"NEW: NATO Sec.-Gen. Jens Stoltenberg: ""The world will hold Russian and Belarus accountable for their actions—Russia as the aggressor, Belarus as the enabler."" https://t.co/CZD2inXTzi https://t.co/YCKhhj6Bz6",67,5,22,en
2022-02-25 18:00:10+00:00,86141342,JUST IN: A new @ABC News/WaPo poll finds sharp partisan divisions on the impact of a Black woman justice: https://t.co/270p4x1ccN,13,5,4,en
2022-02-25 18:08:51+00:00,86141342,"BREAKING: Some 70% of Americans will be able to remove their masks indoors, including inside schools, under new guidance to be released by the CDC today, two sources tell @ABC News. https://t.co/gYadVppbSl",68,82,26,en
2022-02-25 18:28:34+00:00,86141342,"BREAKING: U.K. Prime Minister Boris Johnson will introduce sanctions against Vladimir Putin and Russian Foreign Minister Sergey Lavrov, on top of the sanctions package announced Thursday, a Downing Street spokesperson says. https://t.co/IRhOb44G4E",70,2,21,en
2022-02-25 18:45:00+00:00,86141342,"Smoke arose from a burning security building in Chernihiv, Ukraine, after reports of shelling. https://t.co/Mzunu6LAA9 https://t.co/q5TNTq4mVc",65,6,21,en
2022-02-25 18:52:49+00:00,86141342,"Prince Harry, Meghan to receive NAACP President's Award. https://t.co/ThTsrexppl",42,7,9,en
2022-02-25 19:04:13+00:00,86141342,"JUST IN: The House Jan. 6 committee on Friday interviewed Kimberly Guilfoyle, the fiancé of Donald Trump Jr. and a GOP operative and fundraiser. https://t.co/EKhDKYMq9W",28,6,11,en
2022-02-25 19:24:14+00:00,86141342,Why the U.S. may not be able to drop COVID restrictions like the U.K.: https://t.co/0Edrff2nII,18,2,5,en
2022-02-25 19:31:03+00:00,86141342,Judge Ketanji Brown Jackson delivers remarks as she is set to become the first Black woman to sit on the high court bench. https://t.co/PYwM6qdld6 https://t.co/wJUtJ1c7O7,58,3,17,en
2022-02-25 19:32:23+00:00,86141342,"Supreme Court nominee Judge Ketanji Brown to her two daughters: “You are the light of my life. Please know that whatever title I may hold or whatever job I may have, I will still be your mom. That will never change.” https://t.co/PYwM6qdld6 https://t.co/xsK338m9fn",60,4,15,en
2022-02-25 20:00:15+00:00,86141342,What to know about economic sanctions and how they will affect Russia. https://t.co/YMHzAXTj82,23,3,11,en
2022-02-25 20:00:19+00:00,86141342,"Eiffel Tower lit in the colors of Ukraine in solidarity amid Russia's invasion. 

LIVE UPDATES: https://t.co/q0DZcmD6t0 https://t.co/CpGdklgH0c",492,21,86,en
2022-02-25 20:22:26+00:00,86141342,"Drugmaker Johnson &amp; Johnson and three major distributors finalize nationwide settlements over their role in opioid addiction crisis, an announcement that clears the way for $26 billion to flow to nearly every state and local government in the U.S. https://t.co/1G6t3McbhQ",21,5,11,en
2022-02-25 20:44:44+00:00,86141342,"Scientists are increasingly concerned that the next coronavirus variant might emerge not from people, but animals, as COVID-19 likely did. https://t.co/LyExNfbxTi",24,5,7,en
2022-02-25 20:45:00+00:00,86141342,"Video shows a chaotic scene of crowds trying to flee Kyiv, Ukraine as sounds of what are believed to be gunshots are heard. https://t.co/q0DZcmUHky https://t.co/7kHeUyIDyh",62,9,28,en
2022-02-25 21:33:56+00:00,86141342,"BREAKING: U.S. will sanction Vladimir Putin, Russian Foreign Minister Lavrov, and members of the Russian national security team, White House press sec. Jen Psaki says. 

LIVE UPDATES: https://t.co/CZD2inXTzi https://t.co/GoY4jhNVKy",94,10,29,en
2022-02-25 21:37:16+00:00,86141342,"Ukrainian Pres. Zelenskyy posts selfie-style video showing himself standing outside the president’s office in central Kyiv.

In combat fatigues, Zelenskyy says Ukraine’s army is there and will win. https://t.co/FNGLtZIYLj https://t.co/BINClJ17Pp",371,16,77,en
2022-02-25 22:06:09+00:00,86141342,"Photos taken by @ABC News show emotional families waiting in frigid temperatures to cross the border from Ukraine into Slovakia, where wait times can exceed 10 hours.

An aid worker told ABC the situation becomes even worse during nighttime hours. https://t.co/RJbyRzCXGk https://t.co/YFlMBOWIAi",62,7,30,en
2022-02-25 23:25:00+00:00,86141342,#WorldNewsTonight with @DavidMuir starts in FIVE minutes. RT if you're watching! https://t.co/T4ycAx84Kt,37,11,22,en
2022-02-26 00:57:27+00:00,86141342,"SENATE CONFIRMATION: @RachelVScott joins @DavidMuir to break down what to expect in the upcoming confirmation hearings for Pres. Biden’s historic Supreme Court nominee, Judge Ketanji Brown Jackson. https://t.co/w35IennTbW https://t.co/fN3SRqYdzO",40,8,18,en
2022-02-26 01:30:00+00:00,86141342,"SANCTIONING PUTIN: The White House has announced that the U.S. will sanction Vladimir Putin, Russian Foreign Minister Lavrov, and members of the Russian national security team. @CeciliaVega reports. 
https://t.co/N6PX4MRUsI https://t.co/OU7Tl4VAn2",79,11,35,en
2022-02-26 02:40:00+00:00,86141342,"THOUSANDS FLEE FIGHTING: @MattGutmanABC is at the Ukraine-Poland border as the U.N. estimates that over 100,000 Ukrainians are on the move in the wake of the Russian invasion. https://t.co/N6PX4MAjBa https://t.co/nng87y6dzX",42,3,21,en
2022-02-26 03:00:02+00:00,86141342,"BATTLE FOR UKRAINE: The battle for Ukraine is intensifying with Russian troops closing in on Kyiv, Ukraine as men aged 18-60 are called up to fight and not allowed to leave the country. @IanPannell is there. https://t.co/N6PX4MAjBa https://t.co/R3RkEOQAkB",93,15,46,en
2022-02-26 03:30:00+00:00,86141342,HISTORIC SUPREME COURT CHOICE: Pres. Biden has nominated Judge Ketanji Brown Jackson to become the first Black woman justice. @MaryKBruce reports as the White House hopes she’ll be confirmed by Easter. https://t.co/w35IennTbW https://t.co/jPRCEy17sj,60,10,19,en
2022-02-26 04:00:00+00:00,86141342,"RELAXING MASK GUIDELINES: In new mask guidance, the CDC says based on new metrics, over 70% of Americans are now living in communities at low or medium risk and should be able to remove masks, including in schools. @ErielleReshef reports. https://t.co/7DrMLuqQX6 https://t.co/h0pakB0vH6",27,6,11,en
2022-02-26 17:28:18+00:00,86141342,"People rally in support of Ukraine in front of parliament in Tbilisi, Georgia, after the Georgian Prime Minister said he would not introduce sanctions against Russia in response to its invasion of Ukraine. https://t.co/LjnmXQfT5a https://t.co/o3s9BLfN6C",145,6,32,en
2022-02-26 18:16:03+00:00,86141342,"Russian skiers are not welcome to compete in Norway because of “violations of international law and attacks on the Ukrainian people,” the Nordic country's ski federation said. https://t.co/rzx0BGunSQ",124,4,36,en
2022-02-26 18:44:19+00:00,86141342,"The world will soon experience a steep increase in the number of devastating wildfires as a result of human activity, according to new research released by the United Nations Environment Programme. https://t.co/mKx5Nz05Xq",17,2,10,en
2022-02-26 19:16:00+00:00,86141342,Drugmakers Sanofi and GlaxoSmithKline announced Wednesday they are planning to ask regulators to authorize their new COVID-19 vaccine candidate. https://t.co/umuYMkyeb2,9,1,7,en
2022-02-26 19:37:09+00:00,86141342,"A study released this week has found that ""stand your ground"" laws, which give gun holders the right to use their weapon in public in self-defense, are actually associated with an increase in firearms homicides. https://t.co/hYcLnbqQB6",22,31,19,en
2022-02-26 19:58:01+00:00,86141342,"The Philadelphia Lodge of the Fraternal Order of Police has filed a lawsuit seeking to invalidate a city law banning officers from pulling over drivers for low-level offenses, saying the law illegally preempts existing state laws on traffic violations. https://t.co/lduvpGQyNq",10,2,6,en
2022-02-26 21:18:04+00:00,86141342,The House Oversight and Reform Committee on Friday expanded its investigation into former President Trump's handling of White House records. https://t.co/h0QPKn2ulu,74,21,17,en
2022-02-26 21:42:26+00:00,86141342,"German Chancellor Olaf Scholz announces Germany is dropping its historic position of not providing lethal military aid to conflict zones, saying Russia's ""invasion marks a turning point."" https://t.co/pziFsYyIwI https://t.co/vInImE7XvZ",160,12,35,en
2022-02-26 21:45:23+00:00,86141342,"In a televised address, President Volodymyr Zelenskyy says Ukraine is “successfully repelling” Russia’s attacks and that Kyiv and its outskirts are under the control of the Ukrainian military. https://t.co/1pHTLpf0dM https://t.co/ME5n9VdmhN",381,11,66,en
2022-02-26 21:48:21+00:00,86141342,"BREAKING: Senior U.S. official tells @ABC some Russian forces are disoriented, realizing the battles against Ukrainians are harder than they thought.

A Russian soldier was heard saying on a radio call, “We don’t know who to shoot, they all look like us.” https://t.co/AKVV4EyTtj",196,20,72,en
2022-02-26 22:10:02+00:00,86141342,"Ukrainian tanks move on a road in Lugansk region of eastern Ukraine amid Russia's invasion.

LIVE UPDATES: https://t.co/O9jViiuYog https://t.co/qQJi8pneGg",85,2,18,en
2022-02-26 22:28:03+00:00,86141342,"With more scientists predicting COVID-19 boosters will be needed each year, some are now working on combining those with the annual flu vaccine. https://t.co/zjupyrdBEI",35,9,7,en
2022-02-26 22:30:05+00:00,86141342,"Image shows damage to the upper floors of a building in Kyiv, Ukraine, after it was reportedly struck by a rocket.

LIVE UPDATES: https://t.co/xB0isxZ4mv https://t.co/ZKgonHMJqm",30,2,11,en
