Time,User_ID,Tweet,like_count,reply_count,retweet_count,language
2022-03-05 03:00:02+00:00,86141342,KREMLIN'S MEDIA CRACKDOWN: The Russian government is launching a crackdown on the press there as Putin signs a law making it a crime to spread what the Russian government considers “false information” on Ukraine. @MaryKBruce reports. https://t.co/XWf5X0E4wf https://t.co/5kcATQThqt,68,20,33,en
2022-03-05 03:30:00+00:00,86141342,.@DavidMuir reports on the powerful image amid evacuations from Ukraine—a father and the 5-year-old daughter in the window. https://t.co/XWf5X0E4wf https://t.co/FNkb9GDJwb,117,16,28,en
2022-03-05 04:00:00+00:00,86141342,CIVILIANS PREPARING TO FIGHT: @MattGutmanABC reports from Lviv where many Ukrainian civilians are preparing and training to defend their country against Russian troops as they close in. https://t.co/XWf5X0VFnN https://t.co/j4hJ3zQ3js,65,14,16,en
2022-03-05 17:33:45+00:00,86141342,"The pope has yet to publicly condemn Russia by name for its invasion or publicly appeal to Kirill, and the Vatican offered no comment on the Russian strike on Europe’s largest nuclear plant  https://t.co/udzChZAoRt",31,5,17,en
2022-03-05 17:55:30+00:00,86141342,Officials in Pakistan are vowing to hunt down and arrest the masterminds behind a deadly mosque attack claimed by an Islamic State affiliate. https://t.co/YsHAtbg6PU,24,1,12,en
2022-03-05 18:27:43+00:00,86141342,The hundreds-strong Ukrainian volunteer “hacker” corps that formed in a fury to counter Russia’s blitzkrieg attack is much more than a paramilitary cyberattack force. https://t.co/Umbz8xf5ba,58,5,8,en
2022-03-05 18:53:23+00:00,86141342,Russian driver Nikita Mazepin's contract–which had been until 2025—was terminated “with immediate effect” following the invasion of Ukraine. https://t.co/8RB8oJOhom,53,6,13,en
2022-03-05 19:13:43+00:00,86141342,A Russian citizen who years ago left her home country in opposition to Vladimir Putin’s government has been forced to flee again—this time from her adopted home of Kyiv. https://t.co/hyK5Klvipo,42,4,16,en
2022-03-05 19:35:04+00:00,86141342,"Russia’s attack on a nuclear power plant in Ukraine has revived the fears of people across Europe who remember the 1986 Chernobyl disaster, which killed at least 30 people and spewed radioactive fallout over much of the Northern Hemisphere. https://t.co/xD9eiD25Hl",29,7,11,en
2022-03-05 19:55:16+00:00,86141342,"Black New Yorkers were hit disproportionately hard during the omicron wave compared to white New Yorkers, according to a new analysis from the city's Department of Health &amp; Mental Hygiene. https://t.co/0lK5h5MleC",21,8,8,en
2022-03-05 20:17:40+00:00,86141342,"At Ohmadyt Children's Hospital in Kyiv, pediatric patients are being cared for in the basement of the hospital. https://t.co/EOBi8FxH2U",35,4,14,en
2022-03-05 20:42:44+00:00,86141342,"Ketanji Brown Jackson, Pres. Joe Biden's Supreme Court nominee, has the potential to make history as the first Black woman on the country's highest court. https://t.co/vkp2vmsOy2",52,9,11,en
2022-03-05 21:15:13+00:00,86141342,"Charities say they cannot send humanitarian aid into Ukraine through normal channels, with ports blocked and roads made treacherous by bombings. https://t.co/qSaAiMy9Sn",36,2,12,en
2022-03-05 22:55:05+00:00,86141342,#WorldNewsTonight with @WhitJohnson starts in FIVE minutes. RT if you're watching! https://t.co/CRY8DT7gdz,45,16,15,en
2022-03-05 22:57:39+00:00,86141342,"JUST IN: Visa and Mastercard have suspended their operations in Russia in response to its invasion of Ukraine, the companies said. https://t.co/eNAEYSvkkK",84,9,30,en
2022-03-06 00:30:00+00:00,86141342,"SOARING GAS PRICES: Prices at the pump are soaring at a rapid pace amid the crisis in Ukraine. Experts warn the price per gallon may continue to rise, as the war in Ukraine escalates. @DeirdreBolton reports. https://t.co/OcztcLspzW https://t.co/E9U2sP2s7m",27,27,19,en
2022-03-06 01:30:00+00:00,86141342,GROWING HUMANITARIAN CRISIS: As many as 1.5 million refugees now fleeing Ukraine. Many are families with young children. @marcusmoore on those trying to offer support and comfort. https://t.co/wBzE0LTPjP https://t.co/M2tEgKGvwC,47,19,27,en
2022-03-06 02:40:00+00:00,86141342,"ZELENSKYY'S PLEA TO U.S.: Ukrainian president makes emotional appeal to American lawmakers as Russian president Putin issues a dire new warning. @mattgutmanABC reports from Lviv, Ukraine. https://t.co/wBzE0LCdVf https://t.co/Jyp80LnkyP",76,13,21,en
2022-03-06 03:00:00+00:00,86141342,PUSH TO BAN RUSSIAN OIL: Ukrainian President Zelenskyy pleads with the U.S. to ban Russian oil imports. This as Visa and Mastercard suspend operations in Russia. @maryaliceparks reports. https://t.co/OcztcLspzW https://t.co/x2vTHCQlSl,117,12,33,en
2022-03-06 03:30:00+00:00,86141342,SEVERE STORM THREAT: Millions are on alert as a major storm system sweeps east bringing multiple weather threats. Parts of Iowa and Missouri are under a tornado watch and are facing damaging winds. @robmarciano has the latest. https://t.co/wDwRH2WDxL,32,4,19,en
2022-03-06 04:00:00+00:00,86141342,WNBA ALL-STAR ARRESTED IN RUSSIA: Phoenix Mercury star Brittney Griner detained at an airport near Moscow after authorities say they found vape cartridges containing cannabis oil in her luggage. @Zohreen reports as the State Department weighs in. https://t.co/bPkkWlZyuj https://t.co/cztboYQ4yu,32,16,19,en
2022-03-06 04:30:00+00:00,86141342,Americans across the country are stepping up to help Ukrainians as they face a sudden humanitarian crisis. The need is huge but the show of support is unwavering. @WhitJohnson reports. https://t.co/8GjKnSKO5S https://t.co/Iu91UNA2ES,119,23,42,en
2022-03-06 17:19:30+00:00,86141342,"US Secretary of State Antony Blinken pledged America’s support to the small, Western-leaning former Soviet republic of Moldova that is coping with an influx of refugees from Ukraine and warily watching Russia’s intensifying war with its neighbor. https://t.co/3IM8Vkxq1d",63,5,26,en
2022-03-06 17:48:01+00:00,86141342,"A powerful tornado ripped across central Iowa, killing several people, including children.  https://t.co/ZpzDhQkc3l",30,2,23,en
2022-03-06 18:19:57+00:00,86141342,Hanna Tverdokhlib has held her phone as if it were glued to her hand since the Russian invasion of Ukraine last week. https://t.co/jVxFNRiHCA,37,4,12,en
2022-03-06 18:39:53+00:00,86141342,Russian President Vladimir Putin warned that Ukrainian statehood is in jeopardy and pinned the blame on that country’s leaders. https://t.co/p2UmfcsNZ4,21,6,12,en
2022-03-06 19:11:13+00:00,86141342,"From the earliest days of his first presidential campaign, Donald Trump aggressively dismantled pillars of Republican foreign policy https://t.co/v6F0oVxSqg",42,18,13,en
2022-03-06 19:41:22+00:00,86141342,ANALYSIS: Experts fear Putin will escalate his army's attack on civilian areas. https://t.co/FJkz4xZUPI,29,13,14,en
2022-03-06 20:05:46+00:00,86141342,Experts say kids in war zones are at increased risk of anxiety and depression. https://t.co/FRl5aQVpap,53,20,21,en
2022-03-06 20:26:48+00:00,86141342,"Relatives, parishioners and fellow priests are mourning the Rev. José Enrique Vásquez, who was abducted, shot dead and dumped on a bridge in northern Honduras. https://t.co/9DculG102P",25,8,5,en
2022-03-06 20:50:46+00:00,86141342,"War refugees fleeing Russian ordnance in Ukraine grabbed only the essentials for their journeys to safety: key documents, a beloved pet, often not even a change of clothes. https://t.co/7XpnbeT05Q",63,14,25,en
2022-03-06 21:26:05+00:00,86141342,"In the midst of an ongoing Russian invasion of Ukraine, public health experts are now warning that the COVID-19 pandemic could soon accelerate in the region. https://t.co/E8Rf6V5LKK",41,15,20,en
2022-03-06 22:03:07+00:00,86141342,"""It's not some rule you pass that everybody has to oblige by,"" Sen. Rubio said. https://t.co/4q9k7hGXRe",21,17,4,en
2022-03-06 22:55:07+00:00,86141342,#WorldNewsTonight with @LinseyDavis starts in FIVE minutes. RT if you're watching! https://t.co/wlXm6ywQJ8,43,13,13,en
2022-03-07 00:30:00+00:00,86141342,"Seven people, including two children, tragically killed after a massive tornado and severe storms ripped across Iowa. Communities and homes left unrecognizable- reduced to rubble. @perezreports reports from the tornado zone. https://t.co/EOpP6mj5Xo https://t.co/LqDscGNK3Z",53,10,20,en
2022-03-07 00:49:05+00:00,86141342,"Russia has launched approximately 600 missiles since the invasion began, but Ukrainian resistance is still strong, U.S. defense official says. https://t.co/rqTwXlEYUX",45,8,17,en
2022-03-07 01:30:00+00:00,86141342,The U.N. refugee agency says more than 1.5 million have fled Ukraine since the war started with Russia 11 days ago – making it the fastest-growing refugee crisis Europe has seen since World War II. @marcusmoore reports from the Ukraine border. https://t.co/oyiE1chvYw https://t.co/i90yfT0Igr,41,6,21,en
2022-03-07 02:40:00+00:00,86141342,"The U.S. says there are “very credible” reports Russia has deliberately targeted Ukrainian citizens. More than 300 Ukrainian civilians have died in the war so far, according to the UN, warning the toll is likely much higher. @mattgutmanABC reports. https://t.co/oyiE1chvYw https://t.co/VW2cKVDaB3",71,19,52,en
2022-03-07 03:00:01+00:00,86141342,The Biden Administration and its European allies are under pressure from Ukrainian leaders to further crack-down on President Putin. The White House says they are in active discussions about the possibility of banning Russian oil imports. @maryaliceparks reports. https://t.co/C0gSBFN81I,58,23,20,en
2022-03-07 03:30:01+00:00,86141342,AMERICA STRONG: Americans are finding  innovative ways to help displaced Ukrainian families - from booking Airbnb stays in Ukraine they won’t be using to shooting hoops to raise money. @LinseyDavis reports. https://t.co/cUSYr6rQdq https://t.co/dSKc4W0srS,163,23,45,en
2022-03-07 14:19:36+00:00,86141342,Sec. of State Antony Blinken assures Lithuania of NATO protection and American support. https://t.co/8YPHxsvuuR,44,17,15,en
2022-03-07 14:41:55+00:00,86141342,"Vice Pres. Kamala Harris marked the solemn anniversary of Bloody Sunday with remarks on voting rights in Selma, Alabama, making her trip as congressional efforts to restore the landmark 1965 Voting Rights Act have faltered. https://t.co/dc8Zsc3hgu",38,2,11,en
2022-03-07 15:02:01+00:00,86141342,U.K. lawmakers are set to pass a bill today aimed at toughening sanctions on Russia and rooting out ill-gotten money from the British economy. https://t.co/YBOfXiX5OX,25,3,6,en
2022-03-07 15:21:33+00:00,86141342,"NEW: The Supreme Court says it will not take up the sexual assault case against Bill Cosby, leaving in place a decision by Pennsylvania’s highest court to throw out his conviction and set him free from prison. https://t.co/J5vhdHRoIG",12,9,9,en
2022-03-07 15:46:21+00:00,86141342,Where the Russia-Ukraine conflict goes from here: https://t.co/i8dQItfyPr,14,5,4,en
2022-03-07 16:09:12+00:00,86141342,"EXCLUSIVE: Ukrainian Pres. Zelenskyy to @DavidMuir on new conditions from Kremlin: Putin needs to ""start the dialogue, instead of living in informational bubble without oxygen...He is in this bubble."" https://t.co/Z5Y8sfxZRD https://t.co/RJu6FityhI",74,3,21,en
2022-03-07 16:16:28+00:00,86141342,A police chief in South Florida has been fired after only about six months on the job following an investigation into several discrimination complaints. https://t.co/5wfydTMzgU,21,1,9,en
2022-03-07 16:47:16+00:00,86141342,Queen Elizabeth II held an audience with Canada’s Prime Minister Justin Trudeau in her first in-person engagement since recovering from COVID-19. https://t.co/Y6gIo28Mw8,70,5,5,en
2022-03-07 17:18:46+00:00,86141342,"📸: Queen Elizabeth II held her first major in-person meeting today since her COVID-19 diagnosis. 
 
She received Canadian Prime Minister Justin Trudeau at Windsor Castle. https://t.co/iDv91IPhEU https://t.co/s2GIV6LOoz",149,8,20,en
2022-03-07 17:20:00+00:00,86141342,"EXCLUSIVE: Ukrainian Pres. Zelenskyy to @DavidMuir on concerns over no-fly zone: ""I'm sure that the brave American soldiers who would be shooting it down knowing that it is flying towards the students—I'm sure that they had no doubt in doing so."" https://t.co/bpfYc0ioW4 https://t.co/IsTodxrmE9",91,7,43,en
2022-03-07 18:50:04+00:00,86141342,U.N. Amb. Linda Thomas-Greenfield is standing by the White House and NATO allies' opposition to implementing a no-fly zone over Ukraine. https://t.co/LfipmuZJsx,23,6,13,en
2022-03-07 19:05:05+00:00,86141342,"Plumes of smoke seen rising from a goods depot hit by shelling in Stoyanka, around half a mile to the west of the Ukrainian capital Kyiv. https://t.co/HFRGoAJS8b https://t.co/oxTbTIsVio",33,10,22,en
2022-03-07 19:30:06+00:00,86141342,Musicians played the Ukrainian national anthem in front of the National Portrait Gallery in London's Trafalgar Square amid a rally in support of Ukraine. https://t.co/tn8Eue0hSo https://t.co/U31MqCR1hM,74,3,14,en
2022-03-07 19:40:56+00:00,86141342,"Zelenskyy to @DavidMuir on Putin: ""I think he's capable of stopping the war that he started...he should know one important thing that he cannot deny, that stopping the war is what he's capable of."" https://t.co/riV7CjHINW https://t.co/H531BkGT4y",751,107,221,en
2022-03-07 20:00:31+00:00,86141342,Americans paid a combined $561 million in late payment fees to electrical utilities in 2019. But how much you pay depends on where you live. https://t.co/TiQqfR24ox,15,3,4,en
2022-03-07 20:21:30+00:00,86141342,"EXCLUSIVE: Ukrainian Pres. Zelenskyy to @DavidMuir on his plea to Pres. Biden and the west for fighter jets: ""I'm sure that the president can do more. I'm sure he can. And I would like to believe that—that he's capable of doing that."" https://t.co/kSWWpEcrxz https://t.co/5Cz5sI2t8I",110,17,40,en
2022-03-07 20:51:35+00:00,86141342,A man charged with killing 18 women in the Dallas area said in a newspaper interview he is innocent and will be acquitted. https://t.co/f8re9Fcyyg,12,4,9,en
2022-03-07 21:22:32+00:00,86141342,"Denmark will hold a referendum in June, spooked by Russia’s invasion of Ukraine, on whether to join the EU's defense pact and scrap the Nordic country’s 30-year-old opt-out from the bloc’s common security and defense policies. https://t.co/9XVjYX8GN1",42,2,17,en
2022-03-07 21:45:12+00:00,86141342,"A now-viral photo shows a line of strollers waiting for Ukrainian moms, left by Polish mothers at a train station at the border. https://t.co/GTG92whExt https://t.co/SbRXDz0W7a",121,4,22,en
2022-03-07 22:15:36+00:00,86141342,Utah Gov. Spencer Cox said that he plans to veto legislation that would ban transgender student-athletes from competing in girls sports. https://t.co/vuHCDMoZTc,32,7,10,en
2022-03-07 22:30:50+00:00,86141342,"DEVELOPING: Multiple people shot outside high school in Des Moines, Iowa, police say. https://t.co/mps1tHryhI",29,6,27,en
2022-03-07 22:55:06+00:00,86141342,"With more than 1.7 million refugees already escaping Ukraine and pouring into neighboring countries, @MattGutmanABC reports from a state-run orphanage in Lviv, Ukraine where dozens of children have sought refuge from war-torn cities. More tonight. https://t.co/XWf5X0E4wf https://t.co/KxGyfoghEh",105,16,38,en
2022-03-07 23:02:35+00:00,86141342,"Blinken even appealed to Putin's family history, comparing the Kremlin's siege of Ukrainian cities to Nazi Germany's siege of Russian cities during World War II, which killed Putin's one-year-old brother Viktor. https://t.co/xCqbXTaR4Z",60,13,25,en
2022-03-07 23:25:13+00:00,86141342,#WorldNewsTonight with @DavidMuir starts in FIVE minutes. RT if you're watching! https://t.co/64tV4igXYc,82,17,26,en
2022-03-07 23:53:59+00:00,86141342,China’s exports rose by double digits in January and February before Russia’s attack on Ukraine roiled the global economy. https://t.co/XtNIKE6VSo,10,5,8,en
2022-03-08 00:25:34+00:00,86141342,"The national average price of $4.06 for a gallon of gas is up 45 cents from just a week ago, AAA says.

Here's why they're set to soar even higher: https://t.co/9WdyWuZGPH",21,11,14,en
2022-03-08 00:37:36+00:00,86141342,"UKRAINIANS UNDER ATTACK: As tens of thousands of people across Ukraine are being driven from their homes, civilians have come under intense Russian fire. @IanPannell reports from Kyiv as negotiators met for a third round of cease-fire talks. https://t.co/XWf5X0E4wf https://t.co/P4vteD3mVH",58,15,28,en
2022-03-08 01:30:00+00:00,86141342,BATTLE FOR UKRAINE: A U.S. official says that Ukrainian President Zelenskyy wants fighter jets to counter Russian attacks. @MarthaRaddatz has more. https://t.co/XWf5X0VFnN https://t.co/IDjhChSaXE,71,12,18,en
2022-03-08 02:23:35+00:00,86141342,"RAISING THE PRESSURE: @CeciliaVega reports from the White House with more on the response to Ukrainian President Zelenskyy's claim that President Biden ""can do more” to help. https://t.co/XWf5X0E4wf https://t.co/uA20LDmFj1",29,8,13,en
2022-03-08 02:45:00+00:00,86141342,"ONE-ON-ONE WITH PRESIDENT ZELENSKYY: In an @ABC News exclusive, @DavidMuir spoke to Ukrainian Pres. Zelenskyy, who said that Kyiv, other cities are ""being bombarded,"" demands a no-fly over Ukraine to ""preserve lives"" and vows to stay until the end. (1/2) https://t.co/kSWWpEcrxz https://t.co/bYr28PT6OQ",92,9,38,en
2022-03-08 02:46:00+00:00,86141342,"ONE-ON-ONE WITH PRESIDENT ZELENSKYY: In an @ABC News exclusive, @DavidMuir spoke to Ukrainian Pres. Zelenskyy who issued an urgent message to the American people, saying ""support"" our ""fight"" for freedom. (2/2) https://t.co/kSWWpEcrxz https://t.co/FH2k3ffeRG",197,41,70,en
2022-03-08 03:30:00+00:00,86141342,"OVER 1.7 MILLION REFUGEES: @MattGutmanABC reports from Lviv at a state-run orphanage where dozens of orphans from besieged cities are located—as more than 1.7 million refugees are now escaping Ukraine, including half of those being children. https://t.co/XWf5X0E4wf https://t.co/gfjjJA5Hv5",44,3,26,en
2022-03-08 14:16:20+00:00,86141342,"Pres. Biden will announce the U.S. will ban imports of Russian oil, source tells @ABC News. https://t.co/RIRutr37IN",55,9,16,en
2022-03-08 14:38:38+00:00,86141342,"Florida becomes first state advising against giving COVID-19 vaccine to healthy children, despite CDC recommendation. https://t.co/bKPDp3642E",28,17,12,en
2022-03-08 15:08:56+00:00,86141342,"""Climate is like war: If we don’t handle it, people are going to die and they’re going to be suffering,"" former California Gov. Jerry Brown says. https://t.co/zZ0rRELqt9",40,8,12,en
2022-03-08 15:39:54+00:00,86141342,Ukraine Emergency Services released footage showing a fire at an oil depot in the city of Zhytomyr after a reported strike on Monday. https://t.co/QuuD9da1WE https://t.co/3PaVKWIqFe,17,5,15,en
2022-03-08 15:50:22+00:00,86141342,NEW: Attorneys for Prince Andrew and his accuser Virginia Giuffre file notice informing the court the parties have officially settled the case. https://t.co/xMxbIgWosx,20,14,4,en
2022-03-08 16:11:24+00:00,86141342,"More than 2 million people have fled Ukraine to neighboring countries since Russian forces invaded the eastern European country on Feb. 24, according to the UNHCR. 

Here's where they're going: https://t.co/JRlphKB8h0 https://t.co/ubrXkbrgot",19,6,16,en
2022-03-08 16:31:43+00:00,86141342,"BREAKING: Pres. Biden announces U.S. ban on Russian oil imports.

""Today I'm announcing the United States is targeting the main artery of Russia's economy...The American people will deal another powerful blow to Putin's war machine."" https://t.co/YOH5mHunRi https://t.co/fVgDAzv2vt",86,13,30,en
2022-03-08 16:37:30+00:00,86141342,"Pres. Biden on ban of Russian oil imports: ""I said defending freedom is going to cost. It's going to cost us, as well...Republicans and Democrats alike understand that. Republicans and Democrats alike have been clear that we must do this."" https://t.co/YOH5mHunRi https://t.co/bGaYYTmOlS",49,13,15,en
2022-03-08 16:41:06+00:00,86141342,"Energy giant Shell says that it will stop buying Russian oil and natural gas and shut down its service stations, aviation fuels and other operations in the country. https://t.co/lWB7nOYWz8",31,6,12,en
2022-03-08 16:42:51+00:00,86141342,"""One ruble is now worth less than one American penny.""

Pres. Biden says sanctions have caused Russian economy ""to, quite frankly, crater.""  https://t.co/YOH5mHunRi https://t.co/o4gIFzvuXn",38,3,10,en
2022-03-08 16:45:01+00:00,86141342,"Pres. Biden warns gas prices will rise further as a result of ban on Russian oil imports: ""I'm going to do everything I can to minimize Putin's price hike here at home."" https://t.co/YOH5mHunRi https://t.co/JOArDHg0x2",42,8,15,en
2022-03-08 17:15:35+00:00,86141342,"📸: Ukrainian soldiers help elderly women to cross a destroyed bridge as they evacuate the city of Irpin. 

More than 2 million people have fled Ukraine since Russia launched its full-scale invasion less than two weeks ago, the U.N. says. https://t.co/BleaE4JWYw https://t.co/CJYjXAZ0B7",48,2,19,en
2022-03-08 17:16:09+00:00,86141342,"BREAKING: Florida Senate passes the controversial ""Don't Say Gay"" Bill by a vote of 22-17. If signed by Gov. DeSantis, the law becomes effective July 1. https://t.co/QHZgALHbBF",21,23,10,en
2022-03-08 18:10:10+00:00,86141342,"Russia's invasion of Ukraine has brought up deep divisions in the Middle East, where Moscow has made itself a key player in recent years. https://t.co/YFHVnhyCFd",25,3,6,en
2022-03-08 18:12:18+00:00,86141342,"""We do not want to lose what we have, what is ours, our country, Ukraine,"" Ukrainian Pres. Zelensky tells House of Commons through a translator, ""just the same way as you once didn't want to lose your country when Nazis starting to fight your country."" https://t.co/PCGoIsmztB https://t.co/mwI9aPWzOf",75,3,24,en
2022-03-08 18:20:07+00:00,86141342,"Ukrainian Pres. Zelenskyy addresses House of Commons, telling them his country has faced the Shakespearean question of ""to be or not be.""

""I can give you a definitive answer: it's definitely yes—to be.""

https://t.co/g361MKjye1 https://t.co/QMyIThZaJt",109,5,23,en
2022-03-08 18:47:13+00:00,86141342,These effects were subtle and it's possible many of the people who experience them will heal on their own without medical intervention. But these findings could help explain the cognitive decline experienced by some COVID-19 survivors. https://t.co/3Ss7fQ4CiM,15,5,13,en
2022-03-08 18:58:25+00:00,86141342,"BREAKING: Texas man found guilty on all charges for his role in disrupting the certification of 2020 presidential election.

He was the first to stand trial in the prosecution of those who stormed the U.S. Capitol on Jan. 6. https://t.co/NGY4y6pKOL",71,12,24,en
2022-03-08 19:28:39+00:00,86141342,"Ukrainian Pres. Zelenskyy has earned admiration and respect across a spectrum of leaders in the kind of way most American politicians would envy these days.

Now he's making a direct appeal to the American people. https://t.co/eK9wd0Qqh6",88,5,22,en
2022-03-08 20:01:12+00:00,86141342,Police chief in South Florida fired after only about six months on the job following investigation into several discrimination complaints. https://t.co/isQ9r8cxoa,16,3,6,en
2022-03-08 20:29:28+00:00,86141342,"How far Russian Pres. Vladimir Putin will go, how much longer Ukrainian forces can hold out and what exactly it would take to end the conflict are key questions in the war. https://t.co/H1Yli6XfBc",19,4,8,en
2022-03-08 21:00:50+00:00,86141342,"The Emmett Till Anti-lynching Act, which would make lynching a hate crime under federal law, now heads to President Biden's desk after the Senate unanimously passed the bill on Monday.

Congress failed to pass anti-lynching legislation over 200 times. https://t.co/bTJPCpZC5h",41,6,16,en
2022-03-08 21:11:08+00:00,86141342,BREAKING: Coca-Cola announces the company is joining McDonald’s and Starbucks in suspending their operations in Russia. https://t.co/TOWGCcQZkw https://t.co/By6n8AWXjl,157,9,41,en
2022-03-08 21:12:08+00:00,86141342,"DEVELOPING: Poland says it will provide fighter jets to Ukraine, a surprise reversal of its previous stance. https://t.co/1KZ7HTrcRT",64,2,12,en
2022-03-08 21:20:08+00:00,86141342,LIVE UPDATES: https://t.co/L6Q5o1kcg1 https://t.co/qGQHhPld6g,60,5,19,en
2022-03-08 21:52:08+00:00,86141342,Analysts say a coordinated move on Russian oil by the U.S. and European allies would drastically alter supply to the critical European market—and oil traders expect it will take time for other countries to ramp up production to fill the void. https://t.co/F9JVzaQ2Pk,12,10,7,en
2022-03-08 22:14:44+00:00,86141342,The Defense Department will permanently shut down the Navy’s fuel tank facility in Hawaii that leaked petroleum into Pearl Harbor’s tap water. https://t.co/qHccfccHt8,31,4,12,en
2022-03-08 22:43:54+00:00,86141342,The World Bank says its board approved a package of loans and guarantees for Ukraine totaling $723 million. https://t.co/LOtEZnkPqT https://t.co/GbRKwQiy7r,98,4,20,en
2022-03-08 23:25:18+00:00,86141342,#WorldNewsTonight with @DavidMuir starts in FIVE minutes. RT if you're watching! https://t.co/hVnpezRwKv,59,20,37,en
2022-03-08 23:53:29+00:00,86141342,The latest iPhone SE marks the first upgrade to the bare-bones version of Apple’s most popular product in nearly two years. https://t.co/plAR4BnIf6,14,5,5,en
2022-03-09 00:24:22+00:00,86141342,"As millions of people flee Ukraine amid intensifying attacks from Russia, inside a state-run orphanage in Lviv, dozens of children remain. https://t.co/pjKEw4C9Ul",26,3,12,en
2022-03-09 00:47:06+00:00,86141342,PLANES TO UKRAINE? The Pentagon has rejected Poland’s proposal to supply Ukraine with fighter jets by sending the jets to an American airbase in Germany. @CeciliaVega has more. https://t.co/XWf5X0E4wf https://t.co/559GAkoIpc,59,28,30,en
