Time,User_ID,Tweet,like_count,reply_count,retweet_count,language
2022-03-16 13:34:54+00:00,86141342,"BREAKING: Ukrainian Pres. Zelenskyy addresses Pres. Biden in English at conclusion of his virtual address to U.S. Congress: ""Being the leader of the world means to be the leader of peace."" https://t.co/ypEhF7lIpz https://t.co/HfwgVcZhv3",119,9,41,en
2022-03-16 13:43:11+00:00,86141342,"After more than six decades, a missing girl known as ""Little Miss Nobody"" finally has a name. https://t.co/kIeaOL9uM5",34,5,9,en
2022-03-16 15:23:27+00:00,86141342,"Fox News correspondent Benjamin Hall, who was reporting in Ukraine when he was injured by incoming fire that killed two colleagues, is safe and out of the country, according to the network.

Hall ""is alert and said to be in good spirits,"" the network says. https://t.co/S8UzW2GG8p https://t.co/rcfAvKZr4L",57,4,13,en
2022-03-16 15:23:35+00:00,86141342,"JUST IN: A powerful 7.3 magnitude earthquake has shaken off the coast of Fukushima in northern Japan, triggering a tsunami advisory.

Read the latest: https://t.co/y7jeq8BLOJ https://t.co/fp2MGWzutz",76,8,49,en
2022-03-16 15:27:11+00:00,86141342,"LATEST: A tsunami is not expected in California, Oregon, Washington, British Columbia or Alaska, according to the U.S. National Tsunami Warning Center. https://t.co/BoJUELWLXE",22,2,9,en
2022-03-16 16:00:20+00:00,86141342,"Russia's alleged deployment of the so-called ""vacuum bomb"" on Ukrainian forces prompted widespread backlash. https://t.co/G5xEjvigL0",23,3,10,en
2022-03-16 16:31:04+00:00,86141342,"NEW: Nazanin Zaghari-Ratcliffe and Anoosheh Ashoori, dual British-Iranian nationals detained in Iran for years, have been freed and are on a plane headed to the U.K., Prime Minister Boris Johnson said. https://t.co/7v0aZkD2i4",28,1,3,en
2022-03-16 16:45:09+00:00,86141342,"The head coach and six members of the University of the Southwest men's and women's golf teams were among nine people killed in a head-on vehicle crash in Texas, authorities say. https://t.co/AnX5sxbGiJ",24,2,7,en
2022-03-16 17:00:16+00:00,86141342,"Dramatic photo shows smoke billowing from destroyed helicopters at the Kherson air base, which is under control of Russian forces.

LIVE UPDATES: https://t.co/SdBZaEEZmJ https://t.co/MHVsiAoMz7",23,1,11,en
2022-03-16 17:11:54+00:00,86141342,"""We started our assistance to Ukraine before this war began,"" Pres. Biden says.

""We took the threat of Putin invading very seriously, and we acted on it...So when the invasion began, they already had in their hands the kinds of weapons they needed to counter Russian advances."" https://t.co/QNxYDfCSQ6",40,12,19,en
2022-03-16 17:19:17+00:00,86141342,"Pres. Biden: ""At the request of Pres. Zelenskyy, we have identified and are helping Ukraine acquire additional longer-range anti-aircraft systems, and the munitions for those systems."" https://t.co/FMAh0tTL3N https://t.co/sxJppAa435",35,9,10,en
2022-03-16 17:23:43+00:00,86141342,BREAKING: Pres. Biden announces an additional $800 million in military assistance as part of the $13.6 billion aid package for Ukraine. https://t.co/Nqz63UrbHu,42,8,12,en
2022-03-16 17:47:25+00:00,86141342,"Pres. Biden details $350 million in additional aid to Ukraine, including:

- Anti-air systems
- Anti-tank weapons
- Transport helicopters
- Armed patrol boats
- Radar systems
- Secure communications equipment
- Tactical gear
- Satellite imagery and analysis capacity https://t.co/0gtKat1O0s",96,19,31,en
2022-03-16 17:48:44+00:00,86141342,"Pres. Biden authorizes additional $800 million in new U.S. security assistance to Ukraine, bringing total cost this week to $1 billion. @DavidMuir reports. https://t.co/FPHM6blbPb https://t.co/lBqoEHWy4S",1592,409,490,en
2022-03-16 17:50:20+00:00,86141342,"""This was also a message from Pres. Biden to the American people and to frankly anyone in the world who sees these horrific images that are playing out...and wondering, where is America in all of this?"" @CeciliaVega told @DavidMuir after Biden speaks on war in Ukraine. https://t.co/Jm1UkswIDr",40,7,22,en
2022-03-16 18:10:11+00:00,86141342,A Baltimore judge has ordered new testing for evidence in the case of a man whose murder conviction was chronicled in the podcast “Serial.” https://t.co/ZQpctTeYbH,14,2,10,en
2022-03-16 18:19:59+00:00,86141342,"JUST IN: The Federal Reserve raises its key rate, which it had pinned near zero, by quarter point, marking the start of its effort to curb high inflation. https://t.co/EOeLV4YH2z",23,2,12,en
2022-03-16 18:48:54+00:00,86141342,Nickel trading in London has been suspended shortly after it resumed following a weeklong halt as the exchange investigated a glitch. https://t.co/uLYtKnH5JF,14,4,10,en
2022-03-16 19:19:58+00:00,86141342,Longtime Starbucks CEO Howard Schultz is returning to lead the company on an interim basis after the coffee giant's current chief executive announced his retirement. https://t.co/EHpfISZrFq,14,0,9,en
2022-03-16 19:22:58+00:00,86141342,"JUST IN: Ivan Fedorov, the mayor of the occupied Ukrainian city of Melitopol, has been freed after being kidnapped by Russian troops, according to Ukrainian officials. https://t.co/7M7wLZgeGI",85,2,29,en
2022-03-16 19:38:24+00:00,86141342,"BREAKING: Pres. Biden calls Russian Pres. Vladimir Putin a "" war criminal."" https://t.co/O4mD8nuz5L https://t.co/7h7TlCSmEZ",101,11,27,en
2022-03-16 20:00:20+00:00,86141342,"LATEST: More than half of the 3 million people who have fled Ukraine are children, according to UNICEF. https://t.co/rVPJ2uOnDo https://t.co/6aRCapdx8x",14,1,8,en
2022-03-16 20:22:49+00:00,86141342,"Olympic gold medal-winning gymnast Suni Lee is opening up about the mental health struggles she says she has faced since competing in the Tokyo Olympics last summer, including anxiety and impostor syndrome. https://t.co/8onLS06C3V",15,3,7,en
2022-03-16 20:51:17+00:00,86141342,One expert told @ABC News that creating a no-fly zone in Ukraine would be one of the fastest ways to trigger a war with Russia. https://t.co/Hz38yso69m,26,11,9,en
2022-03-16 21:21:44+00:00,86141342,"The 25-year-old man accused of brutally stabbing an Asian woman to death in her apartment refused to attend his arraignment, court says. https://t.co/DwgYquUiz7",27,10,13,en
2022-03-16 21:35:10+00:00,86141342,"Several vigils were held across the U.S., including in Atlanta, Wednesday in honor of the eight lives lost, including six Asian women, who were killed one year ago at Atlanta-area spas. 

Demonstrators joined lawmakers amid calls for an end to racial hate. https://t.co/m8tUbkGPGc https://t.co/EumdLacZ7P",21,1,8,en
2022-03-16 21:58:21+00:00,86141342,"A suspect remains at large nearly a week after an 87-year-old woman was shoved to the ground in an unprovoked attack on a New York City street, subsequently dying from her injuries, police say. https://t.co/gcIFz89wzb",23,2,19,en
2022-03-16 22:25:06+00:00,86141342,#WorldNewsTonight with @DavidMuir starts in FIVE minutes. RT if you're watching! https://t.co/D3PpcmZyGc,59,6,30,en
2022-03-16 22:55:09+00:00,86141342,"The average full-size SUV owner is spending about $110 more each month on gas than at this time last year, Kelley Blue Book says. https://t.co/TG1mP43mNF",13,3,5,en
2022-03-16 23:26:58+00:00,86141342,Authorities will not bring any charges against the man accused of fatally shooting Jamaican immigrant Peter Spencer nine times on a camping trip in western Pennsylvania last December. https://t.co/cKjXloXjmm,12,5,10,en
2022-03-16 23:30:00+00:00,86141342,INTEREST RATE HIKE: The Federal Reserve has raised the benchmark interest rate a quarter point in an effort to counter the country’s highest rate of inflation since 1982 as several more hikes are expected this year. @RebeccaJarvis reports. https://t.co/pppGRrA5fm https://t.co/jZIPfiJTNb,31,15,11,en
2022-03-16 23:56:43+00:00,86141342,Novak Djokovic and top-ranked Russian tennis players will all be allowed to play at the French Open. https://t.co/fDXYeVijlt,17,7,6,en
2022-03-17 01:05:00+00:00,86141342,HIGHWAY CRASH HORROR: The head coach and six members of the University of the Southwest men's and women's golf teams were among nine people killed in a head-on vehicle crash in Texas. @TrevorLAult has more on the investigation. https://t.co/NlHabWd8W8 https://t.co/y99JlSVsFw,28,4,12,en
2022-03-17 01:40:00+00:00,86141342,"ZELENSKYY: ""WE NEED YOU RIGHT NOW"": @IanPannell reports from Kyiv as Ukrainian Pres. Zelenskyy delivered a powerful address virtually to Congress as cities in the country come under intense fire from Russian forces, Pres. Biden announces more military aid. https://t.co/8gZBaFskku https://t.co/llOtqwaYB0",94,11,35,en
2022-03-17 02:00:01+00:00,86141342,.@DavidMuir reports on the family-owned Wisconsin candle company working to help Ukrainians amid the country’s invasion by Russian forces. #AmericaStrong https://t.co/8gZBaFJVJ4 https://t.co/zZJqeiKPDi,171,16,47,en
2022-03-17 02:30:00+00:00,86141342,"U.S. MILITARY EQUIPMENT TO UKRAINE: @MarthaRaddatz is in Lviv, Ukraine, with more on the new $800 million U.S. military aid package being sent to help the country fight Russian forces. https://t.co/8gZBaFJVJ4 https://t.co/yW9PNEoZN1",29,8,9,en
2022-03-17 03:00:01+00:00,86141342,"BIDEN: PUTIN ""A WAR CRIMINAL"": @MaryKBruce reports from the White House as President Biden for the first time calls Russian President Vladimir Putin a “war criminal” for the invasion of Ukraine. https://t.co/GXDTgN8lOg https://t.co/i7wXdJjXqy",54,11,15,en
2022-03-17 13:13:58+00:00,86141342,"Pres. Biden's COVID-19 coordinator Jeff Zients and his deputy Natalie Quillian are leaving the administration next month, the White House announces. 

They will be replaced by Dr. Ashish Jha, the dean of the Brown University School of Public Health. https://t.co/6qXYnOql2e",12,8,8,en
2022-03-17 13:43:48+00:00,86141342,"The new guidance, the latest addition to Pres. Biden's recent COVID-19 plan, is the first time such a standard has been created at the national level, synthesizing expert guidance on how clean air can prevent the spread of illness. https://t.co/HPLaoBRWzK",12,3,4,en
2022-03-17 15:06:08+00:00,86141342,"Unlike long-range Predator drones, which look similar to small planes and fire missiles at targets, the smallest Switchblade model fits in a rucksack and flies directly into targets to detonate its small warhead. https://t.co/bC13OmnlmG",32,3,12,en
2022-03-17 15:28:28+00:00,86141342,"NEW: Amazon announced it has closed its acquisition of Hollywood studio MGM, two days after European regulators said the deal “would not significantly reduce competition” in European markets. https://t.co/hwCveo07kL",18,3,8,en
2022-03-17 15:59:16+00:00,86141342,"The mayor of an occupied Ukrainian city allegedly kidnapped by Russian forces last week has been freed, Ukrainian officials said Wednesday. https://t.co/AOZLDePI1A",30,3,11,en
2022-03-17 16:27:23+00:00,86141342,Lawmakers in Germany are debating a possible COVID-19 vaccine mandate as the country hit a new record for the number of newly confirmed cases. https://t.co/qFm44pOSDw,14,4,10,en
2022-03-17 17:04:18+00:00,86141342,"At a Kyiv hospital, Ukrainian Pres. Volodymyr Zelenskyy shakes hands with a 16 year-old girl injured as she fled with her family amid Russia's ongoing invasion of Ukraine. https://t.co/h5hRv59uYD https://t.co/yL4uQNfFSq",185,3,28,en
2022-03-17 17:32:44+00:00,86141342,"Americans angered by Russia’s war on Ukraine are taking it out on Russian businesses, brands or anything that sounds Russian. https://t.co/L6fat4SkPS",20,6,13,en
2022-03-17 18:03:23+00:00,86141342,"Pres. Biden met virtually with Irish Prime Minister Micheál Martin Thursday after the Taoiseach tested positive for COVID-19, scrambling holiday plans in Washington and hopes that St. Patrick's Day traditions would return in-person after two years. https://t.co/oTzn8nVtYe https://t.co/kVXdxiaX7v",47,6,10,en
2022-03-17 18:33:22+00:00,86141342,Railway authorities in Poland and Italy say major malfunctions in the electronic control systems have caused significant delays and cancellations on train routes in both countries. https://t.co/6zmCWaNySt,15,4,5,en
2022-03-17 18:35:06+00:00,86141342,"JUST IN: A U.S. citizen was killed in Chernihiv in northern Ukraine, a State Department official confirmed to @ABC News. https://t.co/yIviaci6En",13,3,8,en
2022-03-17 19:03:19+00:00,86141342,"Experts fear U.S. COVID-19 cases will rise in the next few weeks as the new BA.2 variant continues to spread.

CDC data show BA.2, a subvariant of omicron, has been tripling in prevalence every two weeks. https://t.co/i0h7iWs2Qc https://t.co/p3Lx9FjQ02",33,14,29,en
2022-03-17 19:34:54+00:00,86141342,"Fewer Americans applied for unemployment benefits last week, as layoffs continue to decline amid a strong job market rebound. https://t.co/oUE07VVdt0",23,4,8,en
2022-03-17 20:03:47+00:00,86141342,"Drivers of bigger vehicles such as pickup trucks and SUVs are more likely to hit pedestrians while making turns than drivers of cars, according to a new study. https://t.co/xofIYSumfk",16,3,10,en
2022-03-17 20:33:24+00:00,86141342,Railway authorities in Poland and Italy say major malfunctions in the electronic control systems have caused significant delays and cancellations on train routes in both countries. https://t.co/P7lQoHf4Bq,18,4,6,en
2022-03-17 20:34:02+00:00,86141342,"BREAKING: Four people were transported to the hospital after a shooting on a public transit bus in Florida, police said. https://t.co/9pyK6e3a9B",28,9,22,en
2022-03-17 20:59:05+00:00,86141342,"BREAKING: A 13-year-old was at the wheel of the vehicle that swerved in front of a van carrying the University of the Southwest's men's and women's golf teams, killing nine people, including the underage driver, according to the NTSB. https://t.co/m0rEwD6VZN",41,13,18,en
2022-03-17 21:29:22+00:00,86141342,"JUST IN: Two people have died following a shooting on a public transit bus in Florida, police say. https://t.co/xb9Ep2URI3",8,2,12,en
2022-03-17 21:31:27+00:00,86141342,"U.S. Olympic figure skater Alysa Liu and her father Arthur Liu – a former political refugee – were among those targeted in a spying operation that the DOJ alleges was ordered by the Chinese government, the elder Liu says. https://t.co/NSQoOij9Mg",16,0,9,en
2022-03-17 22:00:05+00:00,86141342,.@IanPannell reports from Kyiv and visits a basement shelter where 20 babies born to surrogate moms are being taken care of by nurses who are working around the clock to keep them safe while awaiting their parents from around the world. More tonight with the latest from Ukraine. https://t.co/7Fn4nj0wwB,53,3,20,en
2022-03-17 22:25:10+00:00,86141342,#WorldNewsTonight with @DavidMuir starts in FIVE minutes. RT if you're watching! https://t.co/fUMbtdh58o,67,15,37,en
2022-03-17 22:56:38+00:00,86141342,Efforts to propel Kansas’ renewable energy future are mired in legislative stalemate. https://t.co/JaiOImTgbH,7,2,3,en
2022-03-17 23:27:28+00:00,86141342,"Since November, at least four school shootings had an alarming connection to law enforcement and activists alike; the suspected shooters used a ""ghost gun."" https://t.co/AEmS9diE8B",22,4,12,en
2022-03-17 23:30:00+00:00,86141342,BIDEN TO TALK WITH XI JINPING: @MaryKBruce reports from the White House on the eve of President Biden's crucial one-on-one with China's President Xi after issuing a warning not to assist Russia in the invasion of Ukraine. https://t.co/GXDTgMQKWI https://t.co/9nktDDgshQ,24,12,8,en
2022-03-18 00:30:00+00:00,86141342,"NTSB: 13-YR-OLD BEHIND WHEEL: A 13-year-old was at the wheel of the pickup truck that swerved in front of a van carrying the University of the Southwest's golf teams, killing nine people, according to investigators. @TrevorLAult has details. https://t.co/kvnJDGPcYy https://t.co/8GhaEra1qh",23,8,10,en
2022-03-18 01:40:00+00:00,86141342,BOMBED THEATER SURVIVORS: Rescuers are racing to save potentially hundreds who are feared trapped in a basement of a bombed Mariupol theater. @IanPannell reports as officials say at least one U.S. citizen was killed in a Russian artillery strike. https://t.co/8gZBaFskku https://t.co/JBjgOQsa0M,503,63,235,en
2022-03-18 02:00:01+00:00,86141342,.@DavidMuir has an update on the outpouring of support from those looking to help the people of Ukraine after our report on the family-owned Wisconsin candle company working to assist Ukrainians. #AmericaStrong https://t.co/8gZBaFJVJ4 https://t.co/rHpT6zXQdU,146,10,54,en
2022-03-18 02:30:00+00:00,86141342,"Health officials say a spike in COVID-19 cases in Europe and China could be an indication of a possible surge ahead in the U.S. @SteveOsunsami reports as the new Omicron subvariant, BA.2, makes up nearly a quarter of cases in the country. https://t.co/KYLhaWbEEr https://t.co/fQdMQLnYws",43,9,29,en
2022-03-18 03:30:00+00:00,86141342,GROWING ALARM OVER THREAT: @MarthaRaddatz reports from Lviv with more on the growing threat over possible chemical attacks in Ukraine. https://t.co/8gZBaFskku https://t.co/NzcrdGM1fx,63,16,38,en
2022-03-18 16:26:22+00:00,86141342,"U.S. Ambassador Linda Thomas-Greenfield criticizes Russia ahead of UN Security Council meeting, saying its attempt ""to use this council to launder its disinformation...and justify its unprovoked and brutal attack on Ukraine"" is ""a well-worn playbook."" https://t.co/YWGHZGjzub https://t.co/qqSwx1pcT4",36,6,9,en
2022-03-18 16:31:40+00:00,86141342,"NEW: Russia's Foreign Minister Sergei Lavrov says that any foreign supplies to Ukraine containing military equipment will be considered ""legitimate targets"" for Russian strikes. https://t.co/UuNxe8WQZe https://t.co/Fc9aD1mc3Z",22,20,18,en
2022-03-18 16:34:01+00:00,86141342,Emergency services respond to strike on residential building in Kyiv. https://t.co/tJtsfFa5Xu https://t.co/UBg5USbVQ9,19,1,15,en
2022-03-18 16:40:15+00:00,86141342,"A mother looks on as nurses tend to her baby seconds after giving birth in the maternity ward while sirens announce air raids in Mykolaiv, Ukraine, earlier this week. 

More photos from inside Russia's war: https://t.co/oixPqB3RIy https://t.co/mLhv5DKk9q",45,5,8,en
2022-03-18 16:45:00+00:00,86141342,"NEW: With Pres. Biden’s $15.6 billion request for COVID-19 relief stalled in Congress, federal government plans to begin significantly cutting number of viral treatments available to states, according to internal planning documents obtained by @ABC News. https://t.co/lCmHjCigzM",8,4,6,en
2022-03-18 17:00:15+00:00,86141342,Pillow covers made with portrait depicting Ukrainian President Volodymyr Zelenskyy in Czech Republic. https://t.co/qPOJezdUqd https://t.co/xlG6rqOpZy,45,3,17,en
2022-03-18 17:00:31+00:00,86141342,"NEW: Russia’s lead negotiator in talks with Ukraine said the two sides have made the most progress on the question of Ukraine’s “neutral status” during the negotiations, but that “nuances” remain around issues of security guarantees. https://t.co/cjf775Zukl",10,4,6,en
2022-03-18 17:15:16+00:00,86141342,"From Germany to Moldova to Israel, refugees from Ukraine join local Purim celebrations amid the Russian assault on their country. https://t.co/fHO9jqyuRl https://t.co/VpNwMifQJN",44,2,10,en
2022-03-18 18:00:05+00:00,86141342,"Russian missile strikes hit the western Ukrainian city of Lviv Friday around 6:30 a.m. local time, marking the first strike on the city since the invasion began. https://t.co/uhh1ChXsE2",11,4,11,en
2022-03-18 18:00:18+00:00,86141342,Russia’s request to freeze a FIFA ban on its soccer teams ahead of next week’s World Cup qualifying playoffs is dismissed. https://t.co/RS7kdONEyR,67,6,16,en
2022-03-18 18:14:06+00:00,86141342,Dublin locals marched and waved Ukrainian flags in solidarity in Blanchardstown on Saint Patrick's Day. https://t.co/G2FxwfhiQA https://t.co/FGmjB9QWiu,101,6,20,en
2022-03-18 18:44:31+00:00,86141342,"Over the next few weeks, the U.S. should expect an increase in cases from the BA.2 variant, Dr. Anthony Fauci tells @ABC News, but it may not lead to as severe a surge in hospitalizations or deaths. https://t.co/r7AKM0xvvR",24,3,23,en
2022-03-18 19:15:26+00:00,86141342,Britain’s communications regulator revokes the license of the state-funded Russian broadcaster RT amid concern that its coverage of the war in Ukraine was biased. https://t.co/mZAnVJapOi https://t.co/7ji5bgXvfb,20,1,9,en
2022-03-18 19:46:35+00:00,86141342,"Two weeks after Mila Kunis and Ashton Kutcher started a GoFundMe for Ukraine, the couple updated their followers on Instagram to say that their $30 million goal has been met. https://t.co/E5fhmH03tT",104,3,29,en
2022-03-18 19:46:42+00:00,86141342,"NEW: Pres. Biden ""described the implications and consequences if China provides material support to Russia as it conducts brutal attacks against Ukrainian cities and civilians"" in call with Chinese Pres. Xi, White House says. https://t.co/7NuPAwNoOh https://t.co/cPqiH83Yna",22,8,12,en
2022-03-18 20:00:09+00:00,86141342,"The House has passed the CROWN Act (Create a Respectful and Open Workplace for Natural Hair), in a 235-189 vote which will further put an end to race-based hair discrimination. https://t.co/sbCWfhQcqC",33,7,11,en
2022-03-18 20:11:07+00:00,86141342,New moving images show 109 empty strollers placed outside the Lviv city council to ​represent the number of children killed in the Russian invasion of Ukraine. https://t.co/q0X5SRv2sv https://t.co/602iQKXlr6,60,10,32,en
2022-03-18 20:42:10+00:00,86141342,"Doctors said there are several reasons millions of Americans have yet to contract the virus.

One of those reasons is human behaviors, meaning people take proper precautions to lower their risk of getting infected. https://t.co/UB19GxtiON",26,5,9,en
2022-03-18 21:11:41+00:00,86141342,"Here are some organizations providing food, supplies, medical or legal aid. https://t.co/3JU8ETgxHf",23,7,12,en
2022-03-18 21:40:58+00:00,86141342,"Citigroup, one of the largest financial institutions in the U.S., has begun offering to pay for travel expenses for employees who travel out of state to access reproductive health care. https://t.co/22mPUtPeyk",45,4,15,en
2022-03-18 22:25:10+00:00,86141342,#WorldNewsTonight with @DavidMuir starts in FIVE minutes. RT if you're watching! https://t.co/XD5BXEY2Af,39,10,31,en
2022-03-18 23:30:00+00:00,86141342,BIDEN TALKS TO CHINA'S XI: @MaryKBruce reports from the White House with details on President Biden's high-stakes call with China's President Xi after the two leaders spoke about Russia's invasion of Ukraine. https://t.co/GXDTgN8lOg https://t.co/PEoupDzuwr,23,12,11,en
2022-03-19 01:21:51+00:00,86141342,"Arnold Schwarzenegger has issued a personal plea to the Russian people online warning them about government propaganda and slamming Vladimir Putin for the invasion of Ukraine, urging him to “stop this war.” @MattGutmanABC reports. https://t.co/1oYICJIgEN https://t.co/pjnDRmkkxu",113,11,33,en
2022-03-19 01:40:00+00:00,86141342,RUSSIAN MISSILES RATTLE LVIV: @MarthaRaddatz reports from Lviv where missiles struck for the first time since the Russian invasion and occurred roughly 40 miles from the Polish border as cease-fire talks drag on as civilians continue to suffer. https://t.co/8gZBaFJVJ4 https://t.co/HjpRigVLmq,33,4,18,en
2022-03-19 02:00:00+00:00,86141342,".@DavidMuir reports on Russian star ballerina, Olga Smirnova, who has quit Moscow’s famed Bolshoi Ballet after serving as a principal dancer for more than a decade and is denouncing the country’s invasion of Ukraine.  https://t.co/8gZBaFskku https://t.co/BcETIYD4ZG",141,5,47,en
2022-03-19 02:30:00+00:00,86141342,FOURTH VACCINE SHOT? Moderna is now formally requesting FDA emergency use authorization for a fourth shot for all adults with the move coming days after Pfizer submitted a similar request for Americans 65+. @WhitJohnson has more. https://t.co/KYLhaWbEEr https://t.co/GekHZxmKmA,29,16,13,en
2022-03-19 03:00:02+00:00,86141342,"ALARMING REFUGEE CRISIS: @VictorOquendo is in Poland's capital of Warsaw as the humanitarian crisis deepens, with the UN estimating that nearly 6.5 million people have been displaced inside Ukraine as more than three million refugees cross the borders. https://t.co/8gZBaFJVJ4 https://t.co/ijKl4s67q8",35,5,17,en
2022-03-19 16:08:16+00:00,86141342,"Don Young, the longest-serving member of Alaska’s congressional delegation, has died https://t.co/cmtY1Kkk1g",14,6,7,en
2022-03-19 16:13:03+00:00,86141342,"UPDATE: Four U.S. Marines were killed when an aircraft crashed during a large NATO military exercise in Norway, the Norwegian prime minister said.
https://t.co/8ksgKCZzTQ",59,12,22,en
2022-03-19 16:42:28+00:00,86141342,The daughter of a man who died in California Highway Patrol custody as officers tried to take a blood sample is speaking out about the incident and calling for justice for her father. https://t.co/9FpVF8632q,25,8,11,en
2022-03-19 17:07:36+00:00,86141342,Russia’s request to freeze a FIFA ban on its soccer teams ahead of next week’s World Cup qualifying playoffs is dismissed. https://t.co/zj3EkdqwJH,67,9,17,en
2022-03-19 17:27:12+00:00,86141342,"Dr. Ashish Jha, a leading public health voice familiar to many TV viewers, could bring increased visibility to his new role as White House COVID-19 response coordinator.  https://t.co/JlloJViuTp",101,14,20,en
2022-03-19 17:55:40+00:00,86141342,Education on race and LGBTQ issues has become a hot button issue. https://t.co/B4MpaMjWfs,18,9,5,en
2022-03-19 18:27:14+00:00,86141342,"China’s national health authorities have reported two COVID-19 deaths, the first recorded rise in the death toll since January 2021, as the country battles an omicron-driven surge https://t.co/Mc5NmbC62H",13,5,5,en
2022-03-19 18:56:38+00:00,86141342,"Here are some organizations are providing food, supplies, medical or legal aid. https://t.co/gOvBe2eD2Y",25,5,14,en
