Time,User_ID,Tweet,like_count,reply_count,retweet_count,language
2022-03-25 19:49:59+00:00,86141342,Groundbreaking is set for next month on what's billed as the world's largest wildlife crossing — a bridge over a major Southern California highway that will provide more room to roam for mountain lions and other animals hemmed in by urban sprawl. https://t.co/TZFXzyfZKd,24,1,15,en
2022-03-25 20:19:17+00:00,86141342,Candidates for congressional seats and thousands of smaller races in the Philippines have started campaigning ahead of the May 9 elections. https://t.co/AeW3wcwQj3,8,2,4,en
2022-03-25 20:49:18+00:00,86141342,"The United States is expanding efforts to help Ukrainian refugees. It has agreed to accept up to 100,000 people escaping from the war and to increase support for Eastern European nations that have taken in most of the people fleeing Russian forces. https://t.co/iZFJi4alGz",34,0,9,en
2022-03-25 21:18:09+00:00,86141342,"As New York inches toward launching a retail marijuana market, sales of buds and edibles are already flourishing on some Native American land around the state. https://t.co/iT1OqdZTWV",8,3,6,en
2022-03-25 21:48:21+00:00,86141342,"""CODA"" is making history as the first film starring a predominantly deaf cast in leading roles to be nominated for the best picture Oscar. https://t.co/z7k066Ijxr",38,3,14,en
2022-03-25 22:25:12+00:00,86141342,"#WorldNewsTonight with @DavidMuir anchoring live from Warsaw, Poland starts in FIVE minutes. RT if you're watching. https://t.co/WFUzGGgWvT",69,17,33,en
2022-03-25 22:26:27+00:00,86141342,The latest headlines from Russia's war on Ukraine: https://t.co/BtUF7k7GJA https://t.co/6sEohLbhUg,53,9,27,en
2022-03-25 22:56:46+00:00,86141342,"Half of all states experienced more deaths than births over a 12-month period, largely due to the COVID-19 pandemic, according to a new report from the U.S. Census Bureau. https://t.co/Ul9TlpO5SR",17,7,13,en
2022-03-25 23:25:20+00:00,86141342,"A scathing review has been released evaluating the ""failures"" of the policies that guided Sweden's response to the COVID-19 pandemic. https://t.co/vGFBSKHSQa",23,2,10,en
2022-03-26 01:08:38+00:00,86141342,"THE ORPHANS FLEEING WAR: @DavidMuir reports on the women and children who fled Ukraine for safety, including the orphans of Ukraine - who were without a parent before the war began - and their powerful message for the world. https://t.co/251pYGmrjR https://t.co/g1GJCLC1sH",91,13,36,en
2022-03-26 01:40:00+00:00,86141342,".@JamesAALongman reports as there is a potential shift in the war in Ukraine with Russia facing significant setbacks and appearing to be reframing the mission, with a Russian military general now saying the ""main goal"" is controlling the Donbass region. https://t.co/fdfWNQSdW3 https://t.co/v8LHx4rtGu",55,3,17,en
2022-03-26 02:00:02+00:00,86141342,".@jonkarl reports on the growing scrutiny after text messages show that the wife of Supreme Court Justice Clarence Thomas, Ginni, repeatedly urged former Pres. Trump’s WH Chief of Staff, Mark Meadows, to attempt to overturn the 2020 election. https://t.co/pxzvEUAchD https://t.co/08Ll9A2Uk0",184,30,64,en
2022-03-26 02:30:00+00:00,86141342,BIDEN VISITS U.S. TROOPS: @CeciliaVega has details on Pres. Biden’s meeting with U.S. troops in Poland and his upcoming visit with Ukrainian refugees. https://t.co/kFsVWRU2tX https://t.co/925RXV4pKd,50,2,16,en
2022-03-26 03:00:00+00:00,86141342,RUSSIA FACING KEY SETBACKS: @MarthaRaddatz has details on what the potential shift in Russia’s narrative could mean for the war in Ukraine. https://t.co/fdfWNQAD4v https://t.co/8bdle4cyNh,44,9,16,en
2022-03-26 16:27:55+00:00,86141342,"Taylor Hawkins, the longtime drummer for the rock band Foo Fighters, has died at 50. https://t.co/qm7mWiCzJs",35,7,13,en
2022-03-26 16:53:06+00:00,86141342,"Rep. Jeff Fortenberry of Nebraska was convicted on charges that he lied to federal authorities about an illegal $30,000 contribution to his campaign from a foreign billionaire at a 2016 fundraiser in Los Angeles. https://t.co/MYlc0CvWVM",46,12,23,en
2022-03-26 17:14:14+00:00,86141342,A hiker in Montana has been killed in a suspected encounter with a grizzly bear north of Yellowstone National Park. https://t.co/4j5QimdbXa,34,2,10,en
2022-03-26 17:42:44+00:00,86141342,"Cornell University reports indications of ""substantial prevalence"" of COVID-19 on campus. https://t.co/NXOe7zlIAH",13,7,11,en
2022-03-26 18:13:40+00:00,86141342,A group of CEOs from all major U.S. airlines called on Pres. Biden to lift the federal mask mandate on public transportation. https://t.co/GE6OrwTdrL,18,10,6,en
2022-03-26 18:44:15+00:00,86141342,"The 15-year-old charged with multiple counts of murder stemming from a November mass shooting at Michigan's Oxford High School must remain in an adult jail, a judge ordered. https://t.co/05rUKWaIXF",69,12,15,en
2022-03-26 19:29:03+00:00,86141342,"Two-time Maine gubernatorial candidate Eliot Cutler was arrested for alleged possession of child pornography, two days after search warrants were executed on his two homes in the state. https://t.co/18LZA3Vxa8",36,13,27,en
2022-03-26 19:57:33+00:00,86141342,"Half of the states in the U.S. saw what is known as natural decrease—when more people die in a state or county than are born—between July 1, 2020 and June 30, 2021.https://t.co/RSIpHYvf2o",24,5,17,en
2022-03-26 20:30:15+00:00,86141342,"Individual justices make their own unreviewable calls on a court that lacks a code of ethics. And the issue is not always clear, particularly when spouses also have prominent careers. https://t.co/4I0L0pavon",27,5,11,en
2022-03-26 21:32:06+00:00,86141342,"The therapy is now no longer authorized by the FDA in several states including New York, New Jersey, Connecticut, Maine, Massachusetts, New Hampshire, Rhode Island and Vermont. https://t.co/tBvBcMpLFm",17,4,5,en
2022-03-26 23:30:00+00:00,86141342,RELIEF AT THE PUMP: Several states are taking action to bring drivers some relief at the pump amid skyrocketing gas prices. @DeirdreBolton reports on the new U.S.-EU partnership and what that could mean here in the U.S. https://t.co/0skMT9jkJD https://t.co/q0S5M4nQkZ,38,10,15,en
2022-03-27 00:30:00+00:00,86141342,"MASSIVE EXPLOSIONS ROCK LVIV: Officials in the western Ukrainian city of Lviv say two Russian missile strikes hit multiple targets, including an oil depot.  @JamesAALongman reports from the scene of the attack. https://t.co/ne88TW2SFB https://t.co/lUd2NfSFLy",23,4,14,en
2022-03-27 01:40:00+00:00,86141342,"BIDEN: PUTIN ""CANNOT REMAIN IN POWER"": In a major address in Poland, President Biden forcefully denounced Vladimir Putin and Russia’s invasion of Ukraine. But the White House said Biden was not calling for regime change. @CeciliaVega reports. https://t.co/ne88TW2SFB https://t.co/jvfgwmn8gC",81,25,29,en
2022-03-27 02:00:00+00:00,86141342,"Federal regulators are actively considering whether to offer Americans 50 and older a second Covid booster shot, according to the New York Times. @lipoftv reports as health experts fear a potential resurgence in new Covid cases by the fall. https://t.co/DIlS6ol0WO https://t.co/uz0IK8d3jn",31,9,12,en
2022-03-27 02:30:00+00:00,86141342,One teen basketball star is refusing to let her blindness define her. Jules Hoogland’s shot seen around the world on social media - inspiring millions this week. @jonkarl reports. https://t.co/hnGzMItHDg https://t.co/s0Cxyzx414,113,12,27,en
2022-03-27 14:20:02+00:00,86141342,"Pres. Joe Biden delivered forceful remarks from Poland that reiterated the United States' and its allies' support for Ukraine and said that the war has been a ""strategic failure"" for Russia. Read the full transcript: https://t.co/gY2tQqbnzW",121,15,36,en
2022-03-27 15:25:02+00:00,86141342,Lin-Manuel Miranda is skipping the Oscars after his wife tested positive for COVID-19. Miranda said he has tested negative. https://t.co/yicpbXOc1U,31,4,10,en
2022-03-27 16:08:57+00:00,86141342,"As Caribbean nations debate their relationship with the British crown, Prince William says he will support and respect whatever decision the people make. https://t.co/cySK3hXBHo",37,6,6,en
2022-03-27 16:38:37+00:00,86141342,"A worker who was completing demolition work in a construction vehicle fell over the side of the garage when the structure collapsed, falling a significant height, officials say. https://t.co/Di3cAZ9IlZ",15,2,12,en
2022-03-27 17:04:33+00:00,86141342,Ukrainian President Volodymyr Zelenskyy has accused the West of lacking courage as his country fights to stave off Russia’s invasion https://t.co/KJ9uurc8Cs,46,12,14,en
2022-03-27 17:33:42+00:00,86141342,The proposal for the budget year that begins Oct. 1 shows that the burst of spending helped to fuel growth and put government finances in a more stable place https://t.co/a6jMFagU6c,35,12,5,en
2022-03-27 18:03:49+00:00,86141342,A leading European Union diplomat was holding talks in Tehran amid hopes that an agreement to restore Iran’s tattered nuclear deal with world powers could be completed https://t.co/DhjWQM4QZO,17,8,5,en
2022-03-27 20:14:07+00:00,86141342,A radio station based in suburban Kansas City is facing criticism for airing Russian state-sponsored programming during the Ukrainian war https://t.co/9EFqFzIqKp,28,11,13,en
2022-03-27 20:25:06+00:00,86141342,#WorldNewsTonight with @WhitJohnson starts in FIVE minutes. RT if you're watching! https://t.co/mg4c5fTFw9,32,9,13,en
2022-03-27 23:21:22+00:00,86141342,Hollywood stars and spectators alike are anxiously awaiting tonight’s 94th Academy Awards ceremony. @KaynaWhitworth reports from the red carpet on some of this year’s historic nominations. https://t.co/SpKax6QfH0 https://t.co/3a33W29qAU,23,8,11,en
2022-03-28 00:30:00+00:00,86141342,"FLEEING THE FIGHTING: Stunning new numbers of refugees fleeing Ukraine. @ABCMireya reports from the Ukraine - Poland border, where an American doctor is helping refugees. https://t.co/PpTZZUPz2l https://t.co/yzUloTzrAZ",98,8,36,en
2022-03-28 01:40:00+00:00,86141342,Officials say Ukrainian forces have retaken several villages across Ukraine after Russian missiles damaged several fuel and defense facilities in the war-torn country. @TerryMoran reports as President Zelenskyy reveals what it will take to end this war. https://t.co/PpTZZUxXDL https://t.co/bIfcuHKKnq,48,1,17,en
2022-03-28 02:00:01+00:00,86141342,"FREED AMERICAN SPEAKS OUT: Tyler Jacob, an English teacher in Ukraine, was detained by Russian forces for 10 terrifying days after he tried to flee. ABC News spoke to him in his first television interview since his release. @lipoftv reports. https://t.co/PpTZZUxXDL https://t.co/4bPWOtUSmz",30,0,17,en
2022-03-28 02:30:00+00:00,86141342,"BRAZEN GAS THEFTS: As prices have soared 48% higher than they were a year ago, gasoline thefts from car lots - even driveways - are also on the rise. Experts say the growing problem could get even worse. @DeirdreBolton reports. https://t.co/IxMRzrl8CM https://t.co/XzXnGFR6a4",22,2,11,en
2022-03-28 03:00:01+00:00,86141342,"BITTER COLD BLAST: Millions in the Northeast are bracing for a return to winter as a new storm system brings the threat of severe weather to parts of the South this week. @robmarciano has the latest.
https://t.co/mvFVCANovk https://t.co/0kDuMnSQFR",18,3,13,en
2022-03-28 13:04:13+00:00,86141342,"LATEST: At least 1,119 civilians have been killed and 1,790 others have been injured in Ukraine since Russian forces invaded on Feb. 24, according to the latest figures from the Office of the United Nations High Commissioner for Human Rights. https://t.co/isI6lAJPcB",17,4,12,en
2022-03-28 13:34:20+00:00,86141342,"Jane Campion won the Academy Award for best director, becoming just the third woman to win the accolade. #Oscars https://t.co/L2fyCzonHG",28,2,9,en
2022-03-28 14:02:25+00:00,86141342,"Ukraine and Russia account for a third of global wheat and barley exports, which countries in the Middle East rely on to feed millions of people who subsist on subsidized bread and bargain noodles. https://t.co/hZo6kE4jLv",16,1,16,en
2022-03-28 14:31:56+00:00,86141342,Russian shares slump as its stock market resumes trading of all companies after a monthlong halt following the invasion of Ukraine. https://t.co/OTbCsHPCns,21,2,8,en
2022-03-28 15:02:44+00:00,86141342,"North Korea says leader Kim Jong Un has vowed to develop more powerful means of attack, days after the country's first intercontinental ballistic missile launch in more than four years. https://t.co/U3j6xwO8hA",16,3,10,en
2022-03-28 16:10:46+00:00,86141342,"Latest: https://t.co/xzTUoaScYp

- G-7 says Russia's request for gas payment in rubles is 'not acceptable'

- Russia says radiation levels remain stable despite fires in Chernobyl Exclusion Zone

- Kremlin expresses concern over Pres. Biden's remark in Poland.",20,1,12,en
2022-03-28 16:39:30+00:00,86141342,"""I'm so happy because finally, this validates that everyone is respecting our work as actors in every way."" https://t.co/mUevLE8eZU",195,4,28,en
2022-03-28 17:03:45+00:00,86141342,"An @ABC News analysis of federal data found that on average, the COVID-19 death rates in states that voted for former Pres. Trump were more than 38% higher than in states that voted for Pres. Biden, post-widespread vaccine availability. https://t.co/7IcIBcaWxu https://t.co/K8940JXPPN",40,12,18,en
2022-03-28 17:06:02+00:00,86141342,"BREAKING: Federal judge finds former Pres. Trump ""more likely than not"" committed felony obstruction in the effort to overturn the 2020 presidential election. https://t.co/x50cDNFduH",69,20,19,en
2022-03-28 17:28:19+00:00,86141342,Canada secures its first World Cup berth in 36 years. https://t.co/6UELmS51G7,25,0,7,en
2022-03-28 17:36:57+00:00,86141342,"JUST IN: Florida Gov. Ron DeSantis has signed the Parental Rights in Education bill, dubbed the ""Don't Say Gay"" bill by critics. https://t.co/tUa3fXMWur",30,15,20,en
2022-03-28 18:03:24+00:00,86141342,JUST IN: Jared Kushner expected to appear voluntarily before the House Jan. 6 committee as early as Thursday. https://t.co/AALGwpd0Fb,29,5,14,en
2022-03-28 18:15:07+00:00,86141342,"Betty Taylor was reported missing by her family eight days ago after she told her father was going for a walk and never returned to her home in Safford, Arizona, according to the Graham County Sheriff's Office. https://t.co/0zIq3MAeRH",19,1,17,en
2022-03-28 18:20:03+00:00,86141342,Will Smith slapping Chris Rock at the Oscars provoked intense opinions online. https://t.co/5Ll1LRFFAn,22,14,8,en
2022-03-28 19:00:08+00:00,86141342,"Ariana DeBose gave a shout-out to ""the divine inspiration"" of Rita Moreno, who won the same Oscar 60 years ago at the 1962 Academy Awards for playing Anita in Jerome Robbins and Robert Wise's 1961 film adaptation of ""West Side Story."" https://t.co/NDRDtvswgg",30,3,11,en
2022-03-28 19:20:33+00:00,86141342,"Pres. Biden announces fiscal year 2023 budget and says wealthiest Americans should pay their ""fair share"" in taxes: ""A firefighter and a teacher pay more than double the tax rate that a billionaire pays."" https://t.co/vJQoKhEvWY https://t.co/XANo3m5jwU",50,10,11,en
2022-03-28 19:32:47+00:00,86141342,"JUST IN: Pres. Biden says he was not ""articulating a policy change"" when he said Russian President Vladimir Putin ""cannot remain in power.""

""I was expressing the moral outrage that I feel and I make no apologies for it."" https://t.co/CX68lrUeVp https://t.co/IrOoES2wFJ",92,18,29,en
2022-03-28 20:03:04+00:00,86141342,A new generation of politicians is emerging just in time for the midterms. https://t.co/doK34V6lSH,17,2,8,en
2022-03-28 20:34:26+00:00,86141342,Even the objective of the practice is shaped by the warfare in Ukraine. https://t.co/YLKz16kpQ2,21,5,7,en
2022-03-28 21:07:01+00:00,86141342,"Mississippi, one of the poorest states in the nation with perpetually underfunded schools and struggling rural hospitals, has its largest-ever tax cut passed by lawmakers. https://t.co/2XSXByWJ1W",31,25,24,en
2022-03-28 21:38:57+00:00,86141342,Minneapolis teachers have approved a new contract to end a strike that has kept students out of their classrooms for nearly three weeks. https://t.co/IPJivTLhyo,17,4,5,en
2022-03-28 22:25:12+00:00,86141342,#WorldNewsTonight with @DavidMuir starts in FIVE minutes. RT if you're watching! https://t.co/LH1KZa5mzX,48,11,28,en
2022-03-28 22:54:21+00:00,86141342,"""The disease itself and dealing with it has been invalidating for years because doctors invalidate it, friends and family invalidate it."" https://t.co/rTIUzJLsDB",25,5,13,en
2022-03-28 23:26:13+00:00,86141342,"The cost of direct damage to Ukraine's infrastructure amid Russia's ongoing invasion has reached almost an estimated $63 billion, according to an analysis by the Kyiv School of Economics. https://t.co/OfAlRc6sdu",14,5,13,en
2022-03-28 23:34:24+00:00,86141342,"The Parental Rights in Education bill, which has been dubbed the ""Don't Say Gay"" bill by critics, has been signed into law by Florida Gov. DeSantis. It bans lessons on sexual orientation or gender identity in grades K-3. @VictorOquendo reports. https://t.co/MrTVadIUZQ https://t.co/QYx8roUSWv",25,14,12,en
2022-03-28 23:57:04+00:00,86141342,"73% of U.S. counties saw more deaths than births over that same time frame, up from 55.5% over the previous 12-month period. https://t.co/83BmcIXo0f",15,4,8,en
2022-03-29 00:03:02+00:00,86141342,"NEW: Actor Will Smith apologized on Instagram for slapping Chris Rock after the comedian made a joke about Smith's wife, Jada Pinkett Smith, at the #Oscars. https://t.co/KwaHfXIKD4 https://t.co/xM0wMAIV56",121,55,34,en
2022-03-29 00:30:00+00:00,86141342,".@DavidMuir reports on some of the history-making moments during the 94th Academy Awards, including Troy Kotsur making history as the first deaf man to earn an Oscar after winning best supporting actor for his role in the film “CODA.” https://t.co/cfOIQZYS4z https://t.co/PLZMnEb1Lj",43,5,12,en
2022-03-29 00:40:05+00:00,86141342,"""I would like to publicly apologize to you, Chris. I was out of line and I was wrong. I am embarrassed and my actions were not indicative of the man I want to be. There is no place for violence in a world of love and kindness,"" Smith wrote on Instagram.  https://t.co/0tzL4aKqvO",31,21,18,en
2022-03-29 01:09:26+00:00,86141342,"Germany recorded about 25% more electricity generated from renewable sources in the first three months of the year compared with the same period last year thanks to unusually windy and sunny weather, industry officials say. https://t.co/R2nBxOCygZ",27,3,8,en
2022-03-29 01:39:04+00:00,86141342,"The proposal includes a minimum 20% tax on the incomes of households worth $100 million or more, similar to a proposal Democrats in Congress began debating late last year that failed to clear the Senate. https://t.co/QVZFvh3li7",52,2,18,en
2022-03-29 01:40:00+00:00,86141342,UKRAINE: FORCES RETAKE KYIV SUBURB: President Zelenskyy says Ukrainian forces have liberated a key suburb of Kyiv. @TerryMoran reports as the humanitarian crisis continues to grow. https://t.co/fdfWNQAD4v https://t.co/Lwe91zgIS7,193,7,62,en
2022-03-29 02:00:01+00:00,86141342,".@KaynaWhitworth shares Will Smith’s online apology to Chris Rock as the fallout continues after he slapped the comedian on stage at the Oscars following Rock’s joke about Smith’s wife, Jada. https://t.co/bIO0DolJRf https://t.co/vqaR24ghc4",39,16,15,en
2022-03-29 02:30:00+00:00,86141342,SECOND BOOSTER SHOT? The FDA is expected to authorize a second COVID-19 booster shot for Americans over the age of 50. @EvaPilgrim has details. https://t.co/yBXP4iNaQv https://t.co/LlQfVuHVvZ,21,2,10,en
2022-03-29 03:00:01+00:00,86141342,"BIDEN SLAMS PUTIN: @MaryKBruce reports on Pres. Biden’s clarification of his comment that Putin ""cannot remain in power,” saying he stands by his words and added that he wasn't ""articulating a policy change."" https://t.co/GhL6czXlwL https://t.co/j8TDXHgVc4",44,16,9,en
2022-03-29 13:14:34+00:00,86141342,What to know about a second COVID-19 booster for people over age 50: https://t.co/lnlZXPWCMM,25,8,9,en
2022-03-29 13:43:43+00:00,86141342,"British police say that they are fining 20 people over parties held by Prime Minister Boris Johnson and his staff during coronavirus lockdowns, and that more people could face penalties. https://t.co/W8y5EemqU9",24,5,7,en
2022-03-29 14:10:40+00:00,86141342,The committee probing the Jan. 6 attack recommends the House hold Trump White House officials Peter Navarro and Dan Scavino in contempt of Congress. https://t.co/FPGC9T0AQC,42,10,11,en
2022-03-29 14:39:24+00:00,86141342,"The returned presence of Ukrainian forces in Trostyanets is a relief to a country that hopes some Russian forces, under fierce resistance, are pulling back. https://t.co/ICUwNsYVfk",30,4,10,en
2022-03-29 14:54:20+00:00,86141342,BREAKING: FDA authorizes second round of booster shots for everyone over the age of 50—kicking off the regulatory process for shots to likely be available in pharmacies sometime this week. https://t.co/nQgspg0P1J,37,5,13,en
2022-03-29 15:48:57+00:00,86141342,NEW: Four European countries have expelled a total of dozens of Russian officials: https://t.co/la3qXTT43n,22,2,7,en
2022-03-29 16:18:36+00:00,86141342,📸: Ukrainian government releases photograph showing the Mykolaiv Regional State Administration building with a gaping hole in its center following a Russian attack. https://t.co/CUwxQaMW4Q https://t.co/qCQYIJM2mO,28,4,17,en
2022-03-29 16:49:55+00:00,86141342,"The Das Goat Fire resulted from a vehicle fire on Friday and has now spread across the county, burning more than 1,000 acres. https://t.co/hiWQ2V45Kc",18,1,10,en
2022-03-29 17:19:23+00:00,86141342,President Biden is expected to pay his respects on Tuesday afternoon. https://t.co/FbpaQV2OXt,17,2,4,en
2022-03-29 17:30:10+00:00,86141342,"President Biden will sign the Emmett Till Anti-lynching Act into law Tuesday, making lynching a hate crime under federal law. https://t.co/kdg6biI6xb",35,6,7,en
2022-03-29 17:35:07+00:00,86141342,"LATEST: U.S. is seeing some movement of Russian troops away from Kyiv, as Russia has suggested, but does not view this as a withdrawal but rather a ""redeployment,"" a White House official tells @ABC News. https://t.co/jCLVEiz73Y",20,3,9,en
2022-03-29 17:35:22+00:00,86141342,NEW: White House releases readout of Pres. Biden's call with European leaders about Russia's war against Ukraine. https://t.co/7QA0tl92U6 https://t.co/xcdSZcQbDZ,21,3,10,en
2022-03-29 18:04:04+00:00,86141342,"For red and blue America, a glaring divide in COVID-19 death rates persists two years later. https://t.co/Lqo95yaUv7 https://t.co/Eo6GMK0LwI",31,9,16,en
2022-03-29 18:36:03+00:00,86141342,"She said his vote to block the Jan. 6 committee ""could serve as grounds."" https://t.co/TwEiO4u3gI",74,15,18,en
2022-03-29 19:05:15+00:00,86141342,U.K. National Crime Agency says it has seized a nearly-$50 million superyacht owned by a Russian national in London. https://t.co/ea3755va0y https://t.co/pVoqw0ebcJ,75,4,19,en
2022-03-29 19:37:23+00:00,86141342,"Nielsen is being acquired for $16 billion, including debt, about a week after the TV ratings and marketing data company rejected a $9 billion offer. https://t.co/4onXFmTO6q",8,0,4,en
2022-03-29 20:07:26+00:00,86141342,"The war has raised the specter of food shortages and political instability in countries reliant on Ukrainian wheat, including Indonesia, Egypt, Yemen and Lebanon. https://t.co/sgVmtSLnPs",21,2,10,en
2022-03-29 20:30:09+00:00,86141342,"Pres. Biden paid respects to Rep. Don Young of Alaska, the longest-serving Republican in the history of the House of Representatives, who is being remembered Tuesday as his body lies in state in National Statuary Hall. Young died at 88 earlier this month. https://t.co/jCrssbYC7u https://t.co/YwTVE10MZl",28,1,7,en
2022-03-29 20:38:56+00:00,86141342,MOMENTS AGO: Pres. Joe Biden signs the Emmett Till Antilynching Act into law. https://t.co/lLHEHuieuJ https://t.co/gMgddFHabH,66,5,23,en
2022-03-29 20:39:39+00:00,86141342,"JUST IN: Pres. Biden: ""No federal law—no federal law—expressly prohibited lynching. None. Until today."" 

READ MORE: https://t.co/senA29OhyY https://t.co/x3emYByReo",55,9,21,en
2022-03-29 20:45:07+00:00,86141342,Sec. of State Antony Blinken said the U.S. remains skeptical that Russia is engaging genuinely in negotiations with Ukraine to end its monthlong war against its neighbor. https://t.co/mhn0HDKYXT,19,8,13,en
2022-03-29 21:16:01+00:00,86141342,"Joao ""Julia"" da Silva, a 23-year-old trans woman, has been missing since March 24, when she was last seen by family members leaving her residence in North Bay Village, Florida. https://t.co/HQUW0tTrQ8",10,5,11,en
2022-03-29 21:47:36+00:00,86141342,This airmass was so unseasonably cold for this time of the year that on Monday there were dozens of record cold high temperatures from New York City to Boston. https://t.co/IVCZxqxO0W,13,0,6,en
2022-03-29 22:25:12+00:00,86141342,#WorldNewsTonight with @DavidMuir starts in FIVE minutes. RT if you're watching! https://t.co/M0Dsf3MDyP,61,15,36,en
2022-03-29 22:56:28+00:00,86141342,An Ethiopian court has ordered Ethiopian journalist Amir Aman Kiyaro to be released on bail after being imprisoned for four months without charges. https://t.co/niANaljDQx,19,0,7,en
2022-03-29 23:25:41+00:00,86141342,"A two-phase lockdown of Shanghai’s 26 million people is testing the limits of China’s hard-line “zero-COVID” strategy, which is shaking markets far beyond the country’s borders. https://t.co/RdHC5jL4JI",17,2,8,en
2022-03-29 23:53:53+00:00,86141342,"TRUMP PHONE LOG GAP: The House select committee investigating the deadly Jan. 6 Capitol attack has found a seven-hour gap in former Pres. Trump’s White House call logs on the day of the riot, sources say. @jonkarl reports. https://t.co/TFgzJeueCd https://t.co/7JgHzLrNDY",147,51,59,en
